한글,영문,설명
가공선,Factory Shipa,선내에 수산물 가공설비를 갖추고 어선에서 수획한 어류를 선상에서 가공하는 선박
가단주철,Malleable Cast Iron,백주철을 열처리하여 내부에 함유된 탄소를 제거하여 가단성(Malleability)을 부여한 주철(Cast Iron)을 일컬음
가드레일,Guard Rail,추락이나 위험접근을 방지하는 손잡이 또는 레일
가변전압용접기,Variable Voltage Welding Machine,전류의 증가에 따라 전압이 자동변화하는 형식의 아크용접기
가변피치 프러펠러,Controllable Pitch Propeller,프로펠러 날개가 각도를 바꾸어 핏치를 조절하도록 장치된 프로펠러, 피치조절프로펠러와 동일
가설지 붗,Canopy,무갑판선에서 풍우를 막기 위하여 설치하는 범포 가리개
가속도,Acceleration,시간에 대한 속도의 변화율, 속도를 v, 시간을 t라 하면, 가속도는 dv/dt가 됨
가솔린 기관,Gasoline Engine,가솔린과 공기의 혼합가스를 실린더 내에서 전기스파크로 폭발시켜 그 팽창력으로 피스톤을 움직여 회전력을 얻는 동력기관
가스 경납땜,Gas Brazing,가스불꽃으로 가열하여 땜질하는 경납땜
가스 기관,Gas Engine,상온에서 기체상태인 연료를 사용하는 내연기관, 천연가스, 용광로가스, 프로판 가스 등이 사용됨
가스 브레이징,Gas Brazing,가스불꽃으로 소재를 가열하는 경납땜
가스 트라이얼,Gas Trial,액화가스운반선이 완성도면 화물의 하역 시스템 작동확인을 위하여 치르는 작동시험
가스 퍼징,Gas Perging,기존 가스의 위험한계를 낮추기 위하여 다른 불활성가스로 치환하는 것
가스가우징,Gas Gouging,가스불꽃과 산소로, 용입을 깊게하기 위하여 접착부 사이에 홈을 파는 방법
가스감시기,Gas Monitor,실내에 누출된 유해가스의 농도가 위험수준에 달하면 경보를 표시하는 장치
가스마스크,Gas Mask,유해가스가 있는 공간에서 사람의 호흡을 돕기 위하여 사용되는 산소호흡기, 공기청정기 등이 부착된 마스크
가스압접,Gas Pressure Welding,가스에서 발생하는 불꽃열을 이용하는 압접
가스용접,Gas Welding,가스불꽃의 열을 이용하는 용접법. 보통 산소 아세틸렌용접을 말함
가스절단,Gas Cutting,가스불꽃으로 가열하고 금속과 산소의 급격한 화학반응을 이용하여 절단하는 방법
가스터빈,Gas Turbine,연료연소에서 얻어지는 고온 고압가스로 터빈을 회전시키는 동력기관
가스퍼리 팬,Gas Free Fan,탱크 내의 위험가스를 배출할 때 사용하는 핀
가역성,Reversibility,어떤 하나의 체계가 다른 상태로 바뀌었다가 역으로 원상태로 돌아올 수 있는 성질
가연성 가스,Combustible Gas, Flamable Gas,공기 중에서 연소될 수 있는 가스
가열굽힘시험,Temper Bend Test,일정온도로 가열한 시험편을 굽혀서 그 온도에서의 물성을 관찰하는 시험
가열조립,Shringkage Fit,가공 공차를 조절하여, 바깥쪽 부재를 가열 팽창시킨 후 내부재를 삽입하여 바깥 부재가 정상온도에서 수축되면, 완벽에 가까운 결합을 얻는 조립방법
가이,Guy,하역 붐의 끝과 선측의 불워크나 갑판과 연결하는 줄, 붐을 고정하거나, 회전시킬 때 사용함
가이 윈치,Guy Winch,가이를 풀어주거나 감아당기는 윈치
가접(가용접),Tack Weld,본용접 전에, 부재를 고정하여 용접부위가 서로 맞도록 하는 짧은 용접 (나중에 본용접으로 덮임)
가짜 굴뚝,Dummy Funnel, Dummy Stack,전함에서 적을 혼돈시키기 위해 설치하는 외관상의 굴뚝
가축운반선,Cattle Carrier,가축을 전용으로 운반하는 선박
가침장,Floodable Length,선박의 어떤 길이의 구획이 부력을 잃고 침수되어도 배의 침하가 한계선 이하로 일어나지 않는 길이
가항수역,Navigable Waters,선박 항해가 가능한 깊이와 폭을 가진 하천, 항구 또는 해역
각창,Rectangular Window, Square Window,채광고 통풍을 위해 갑판 상부 공간 벽에 설치하는 사각형의 창
각형선미,Square Stern,배의 뒤끝이 수직평면으로 이루어진 선미
간조,Low Water, Low Tide,썰물 때 해수면이 제일 낮아진 상태
갈고리 도르래,Hook Block,고리에 걸도록 갈고리가 붙은 도르래
감마선 검사,Gamma Ray Inspection,방사선의 일종인 감마선을 투사하여나타나는 내부모양으로 구초를 검사하는 방법, 방사선검사 참조
감속,Speed Reduction,추진기관의 출력조절로 선박의 속력을 늦추는 것
감속장치, 감속기어,Reduction Gear,주기관과 추진기 사이에서, 추진기가 적정 회전수를 유지하도록 주기관의 회전수를 줄여주는 기어뭉치, 또는 장치
감요 탱크,Anti-rolling Tank,횡동요 감쇄탱크 참조
감요장치,Anti-motion Device, Stabilizer,선박의 동요억제를 위하여 설치하는 장치로, 앤티 로링 탱크, 앤티 피칭 탱크, 핀 스태빌라이저 등이 있음
감톤 구멍,Tonnage Opening,배의 톤수를 줄이기 위하여 차량갑판 등의 최상층에 구멍을 내는 것, 실제로는 침수를 막는 뚜껑을 덮어 건조구역을 유지함
갑문,Dock Gate,운하, 강 또는 독(선거)에 설치하는 수밀 문
갑판,Deck,선체의 수평방향으로 설치된 판상태의 구조물로서 선체의 수밀성, 강도, 강성을 주며, 승객과 선원주거공간, 화물의 적재와 기기 설치공간 등에 필요한 바닥을 형성함
갑판 거더, 덱 거더,Deck Girder,갑판 아래 붙여진 종방향 보강재로 판재, 형재 등이 설치됨
갑판 기둥,Deck Stanchion,2층갑판 사이에 세워진 수직기둥
갑판 배기관,Deck Exhaust Pipe,갑판기계에서 사용한 증기배기를 보일러로 되돌려보내는 파이프
갑판 배수구,Deck Scupper,상갑판의 양현에 설치된 배수구
갑판 보,Deck Beam,갑판 아래 일정한 간격으로 붙여진 종방향(Longitudinal) 또는 횡방향(Transvers)의 보강재
갑판 세로보,Deck Lomgitudinal,갑판 아래 세로방향으로 붙인 갑판보
갑판 스토퍼,Deck Stopper,앵커체인이나 결박용 체인을 갑판 위에서 고정시키는 기구
갑판 스트링거,Deck Stringer,갑판을 구성하는 강판 중 현측(가장자리)에 까는 강판
갑판 증기관,Deck Steam Pipe,갑판에 설치된 윈치, 윈들라스 등의 동력으로 사용되는 증기를 공급하기 위한 배관
갑판 출입구,Booby Hatch,노출갑판에서 거주구역으로 통하는 출입구
갑판 컴포지션,Deck Composition,거주구역 통로나 노출갑판에 덮이는 피복재로 시멘트 몰탈을 기본재료로 합성수지, , 아스팔트 등이 적절히 혼합됨
갑판 크레인,Deck Crane,갑판 위에 설치되는 동력 기중기
갑판 트랜스버스,Deck Transverse,종늑골식 선각구조에서 갑판 아래 종방향으로 설치되는 모든 골지로 선저, 선측, 갑판, 격벽 등을 두루 보강하는 링 모양을 형성함
갑판 평면도,Deck Plan,갑판의 구조배치가 표시된 평면도면
갑판 프리즘,Deck Prism Light,갑판유리와 같은 목적으로 갑판에 끼우는 채광 프리즘
갑판간 화물창,Tween Deck Cargo Space,2층으로 된 갑판(Tween Deck) 사이에 마련 된 화물창
갑판간사다리,Tween Deck Ladder,2층으로 된 갑판(Tween Deck) 사이를 오르내리도록 설치된 사다리
갑판구조물,Deck Erection,갑판상에 탑재된 구조물로서 선미루, 선수루, 선교, 엔진케이싱 등을 일컬음
갑판기계,Deck Machinery,갑판위에 설치되는 윈치(Winch), 윈들러스(Windlass), 조타기(Rudder Bearing) 등의 기계장치를 통칭함
갑판높이,Deck Height,바닥(Base)에서 측정한 갑판의 수직높이
갑판배관,Deck Pipe,갑판상에 설치되는 각종 배관
갑판보 캠버, 빔 캠버,Beam Camber,갑판상에서 중앙부의 높이와 현측의 높이에 차를 두어 배수가 잘 되도록하는대 두 높이의 차를 말하며, 보통 갑판 최대폭의 1/50 정도임
갑판보브래킷, 빔 브래킷,Beam Bracket, Beam Knee,갑판보(Beam)와 늑골(frame)을 연결 시켜주는 삼각형 판재
갑판부,Deck Department,선박의 조종, 항해, 하역,  화물보관, 선체정비, 선체안전 등과 이에 따르는 장비, 부속물 등을 다루는 부서, 기관부와 대칭됨
갑판속구 목록,,갑판부에서 쓰이는 용구(비품)의 종류, 명칭 수량등을 적은 목록
갑판승강형 굴착선,Self Elevating Drilling Unit,굴착 시에 승강용 다리를 해저에 내리고 선체를 해면 위로 들어올려 석유 등을 굴착하는 굴착선
갑판시계,Deck Watch, Hack Watch,천체관측, 무선수신기 등에 쓰이는 크로노매터(chronometer : 초정밀 시계)에 보조로 사용되는 휴대용 시계, 선내 시계들의 기준이 됨
갑판실,Deck House,상갑판 위나 선루갑판 위에 설치되는 작은 공간구조물, 선폭에 미치지 않는 작은 구조
갑판여객,Deck Passenger,노천갑판 상에 태우는 승객
갑판원,Sailer,갑판부의 보통 선원
갑판유리,Deck Lighr,갑판 아래 공간의 채광을 위하여 갑판에 끼우는 두꺼운 유
갑판의장,Deck Fittings,갑판에 직접 붙여지는 무어링 파이프(Mooring Pipe), 볼라드(Bollard), 초크(Chock), 페어리더(Fair Leader) 등의 의장품
갑판장,Boatswain, Bosn,갑판원을 지휘하여 배의 정비, 선체보존, 보수, 하역작업 등을 수행하는 승무원
갑판장갑,Deck Protection, Deck Armour,군함에서 포탄이나 폭탄 등에 견디게 하기 위하여 붙이는 두꺼운 강철 또는 특수강판
갑판적재 목재화물,Timber Deck Cargo,갑판 상에 적재하여 운송하는 목재화물, 적재방법, 높이, 조정방법 등을 별도로 규정함
갑판창고,Deck Dtore,갑판에서 쓰이는 기구, 보존품 등을 보관하는 창고로서 보통 선수루에 위치함
갑판청소 펌프,Deck Wash Pump,갑판 청소용 급수펌프
갑판청소관,deck Wash Pipe,갑판을 청소하기 위하여 설치된 급수파이프로, 청소용 호스를 연결하도록 창치됨
갑판침수,Deck wetness,갑판의 일부분(선수의 노출갑판)이 파도를 맞아 물을 덮어쓰는 현상
갑판피복,Deck Covering, Deck Sheathing,갑판 상면을 나무, 시멘트 몰탈, 콤포지션 등으로 덮는 것
갑판현측선,Deck Side Line,갑판 하면과 외판 내면이 만나는 선
강갑판,Steel Deck,철강판으로 된 갑판
강괴,Steel Ingot,용해된 강철을 몰드에 주입하여 일정한 크기로 만든 덩어리
강도,Strength,재료가 각종 외력에 견디는 능력, 인장강도, 압축강도, 굽힘강도, 비틀림강도 등이 있음
강도건현,Strength Freeboard,국제만재흘수선규약에 따라 정해지는 선체 강도기준의 흘수선
강력갑판,Strength Deck,선체 중앙부에서 배 길이의 반 이상을 덮는 최상층의 갑판, 보통 상갑판이 해당됨
강선,Steel Ship,철강재로 건조된 배
강성,Stiffeness, Rigidity,구조물이 하중을 받아도 변형되지 않고 버티는 성질
강재배치도,Construction Profile and Deck Plan,선체의 주요 강도부재의 비치, 치수, 형상 등을 나타낸 도면
강재적치장,Bteel Bay, Steel Yard,조선소 내에 들여온 강재를 저장하는 장소
강제 호우저,Steel Hawser,배를 묶거나 끄는데 쓰는 철강제 밧줄
강제윤활기,Forced Lubricator, Pressure Lubricator,압력을 가하여 강제적으로 윤활시키는 기기
강제창구덮개,Steel Hatch Cover,철강재로 된 화물창구의 덮개
강제통풍,Forced Draft,송풍기로 공기를 화로에 강제적으로 불어넣는 통풍방식
강철,Steel,0.03~1.7%의 탄소를 함유하는 철 합금, 보통 탄소강이라 하며, 여기에 Ni, Cr, Mn, W, Mo 등이 첨가되면 특수강이 됨
강판,Steel Plate,강괴를 압연하여 판 상태로 만든 철강재
강합판,Clad Steel,성질이 서로 다른 강판을 겹으로 붙인 겹판으로, 강판 + 스테인리스강판, 강판 + 크롬강판  등이 있음
개구폐쇄장치,Closing Appliances,선내 각 부분의 개구부(Opening)를 막아주는 장치
개방검사,Overhaul Inspection,기계 또는 선체 등을 개방 분해하여 자세히 실시하는 검사
개방베어링,Open Type Bearing,안 쪽 링과 바깥 쪽 링이 분해되게 만든 베어링
개방이음,Open Joint, Gap Joint,접합될 두 부재 사이를 약간 띄어놓고 하는 용접
개스킷,Casket,파이프 플랜지 이음매에 누설을 막기 위해 끼우는 칼라 또는 라이너, 수밀문이나 현창에 돌려 끼우는 수밀 고무
개장순양함,Auxiliary Cruiser, Merchant Cruiser,상선을 일시적으로 개조하여 만든 순양함
개정도면,amendment Plan,설계도 상에 변경사항이 생겼을 때 그 내용을 포함하여 다시 작성된 도면
개지물,Inclusion,용접시 용착금속에 끼어들어간 불순물
개폐식 도르래,Snatch Block,로프를 끼우도록 몸통 덮개를 여닫을 수 있게 만든 도르래
개회로 전압,Open Circuit Voltage,회로가 끊어져 전류가 흐르지 않는 양 단자 사이의 전압
객선,Passenger Ship,여객을 운송하는 배
갠트리 크렌,Gantry Crane,레일 위에 네 발을 얹고 발에 달린 바퀴를 구루게 하여 이동하는 몸체가 큰 기중기
갤로스,Gallows,오터 트롤선(Otter Troller)에서 오터보드나 어망을 올리거나 내릴때 쓰는 고정식 아치형 데릭, 이동식도 나타남
갤리선,Galley,옛날 지중해지방 토인들이 사용하던 10~12인승의 노를저어 움직이는 보트
갱,Dang,하역장치들의 편성 단위 또는 작업조직의 단위
갱웨이,Gangway,돋(Dock) 양쪽 벽 안으로 통하도록 나있는 통로, 선측 불워크 또는 핸드레일에 설치한 출입구
갱웨이 포트,Gangway Port,사람이 출입하도록 선측에 뚫은 개구
거널,Gunwale, Gunnel,배나 보트의 양현 상단
거널 앵글(바),Gunwale Angle(Bar),선측 상단에 붙는 종통 형강재
거널 탱크,Gunwale Tank, Topside Tank,상갑판과 외판이 붙는 선측에 만들어진 평형 또는 트림 조절용 탱크
거대선 표시등,Flashing Light for Huge Vessel,선박 길이가 200m 이상인 배에 다는 표시등, 180~200회/분 깜빡이는 녹색 전주등임
거더,Girder,종방향으로 통하는 대형 골재
거더간격,Girdre Space,거더와 인접한 거더 간의 거리
거더구조,Girder Work,수직한 웨브와 수평으로 붙는 플랜지로 조립된 T형, 또는 L형의종강도 부재
거리눈금,Distance Marker, Range Marker,레이더 표시면 상에 목표물 거리를 나타내 주는 눈금(동심원)
거북등 갑판,Turyle Back Deck, Whale Back Deck,갑판에 들이치는 물이 머무르지 못하게 하기 위하여 현측을 둥글게 한 갑판, 북미 오대호의 특수선에 적용함
거스길이,Girth Length,선체 횡단면의 외판내면형상을 따라 잰 길이, 외판전개도 등에서 이용함
거위목형 통풍통,Gooseneck Ventilator,물팅크나 기름탱크 등의 환기를 위하여 붙이는 거꾸로 된 U자형 파이프의 자연통풍통
거젼,Gudgeon,핀틀을 끼우기 위한 힌지로 선미재의 타축 핀이 지지되는 끝 부분
거젼 핀,Gudgeon Pin, Piston Pin,타의 회전축 하단의 핀으로 선미재의 거젼애 꼽힘, 피스톤 기관에서 피스톤과 연결봉을 연결시키는 핀
거주갑판,Accommodation Deck,선원이나 승객의 거주공간이 배치된 갑판
거주설비,Accommodation Deck,배안의 선원 및 여객이 거주하는데 필요한 설비들의 총칭
거주실 배치도,Accommodation Plan,배안의 거주실 배치를 나타낸 도면
거칠기,Roughness, Height or Magnitude,물체 표면의 거칠기 정도를 길이로 표시한 것, 최대거칠기, 제곱평균제곱근 거칠기, 평균 거칠기 등으로 표시함
거칠기저항,Roughness Resistance,선체 표면의 거칠기로 생기는 저항
거터 배수로,Gutter Water Way,갑판 위의 배구를 위한 수로
거터 앵글,Gutter Angle, Gutter Bar,현측 갑판의 배수로를 형성하기 위하여 붙이는 형강
건선거,Dry Dock, Graving Dock,선박의 건조, 수리, 침수면도장, 검사 등을 위하여 설비된 수문이 붙은 풀(Pool)로 배가 입거하면 수문을 닫고 물을 펌프로 퍼내고 작업이 완료되면 물을 다시채우고 수문을 열어 배가 나감
건조 식량고,Dry Provision Store,건조한 식량만을 저장하는 창고
건조선거,Building Dock,선박을 건조 할 수 있는 설비(기중기 등)가 갖추어진 건선거(Dry Dock)
건착망어선,Purse-seine Netter, Purse Deiner,사각형 수직그물로 어군을 포위하고그물 바닥을 줄로 졸라막아 선측으로 끌어올려 고기를 퍼내는 방식의 어선
건현,Freeboard,선체 중앙부 건현갑판의 현측상면에서 만재흘수선 까지의 수직거리
건현 폭,Freeboard Breadth,배의 중앙부에서 좌 우현의 늑골 외면 간의 길이, 유조선, 벌크화물선 등에서는 배의 형폭과 일치함
건현갑판,Freeboard Deck,건현측정 기준이 되는 최상층의 전통갑판, 일반적으로 상갑판(Upper Deck)이 해당됨
건현길이,Freeboard Length,용골 상면에서 잰 최소 형 깊이 85%의 높이의 흘수선 길이 95%와, 흘수선 상에서 선수재 전면에서 선미 타두재  중심 까지의 흘수선 길이 중 큰 것
건현비,Freeboard Ratio,건현 높이와 배 길이의 비율
건현표시,Freeboard Mark,배가 직립상태에서 만재흘수선규정에 의하여 적재가 허용되는 최대흘수선을 표시하는 마크, 만재흘수선표시와 동일
건화물,Dry Cargo,건조한 화물의 총칭
걸이의자,Boatswain`s Chair,마스트나 외판 등에 매달려 작업할 때 사용되는 1인용 걸이 의자
검사,Survey, Inspection,기계 또는 부품이 설계 대로 제작되었는지를 조사하여 결함 유무를 밝히는 일
검사 해머,Test Hammer,기계나 조립품 등을 가볍게 두드려 나는 소리로 내부결함을 찾아내는 데 쓰이는 가벼운 망치
검사구멍,Inspection Hole,선박의 정기검사 등에서 외판, 갑판 등의 두께를 확인하기 위하여 뚫는 구멍으로 확인 후 용접으로 메꾸어짐
검사뚜껑,Inspection Cover,기계나 장치를 분해하지 않고 들여다볼 수 있게 뚫어논 구멍과 덮개
검사원,Surveyor, Inspector,선박과 내부의 장치, 설비, 기구 등이 규정 대로 유지되어 항해에 적합한지를 검사하는 사람, 화물적재나 훼손 등의 손해를 조사하는 사람
검수원,Tally Man,화물을 실을 때 화물의 수량을 확인 기록하는 사람
검역기,Quarantine Flag, Yellow Flag,항내에서 검역을 필요로 하는 배가 계앙하는 기, 국제신호기의 Q자로 황색 사각기임
검역등,Quarantine Light,검역 중임을 표시하는 등으로 홍등과 백등을 상하로 달아 사용함
검역선,Qusrantine Boat,전염병 전파를 방지하기 위하여 해상검역활동을 하는데 이용되는 선박
검역항,Quarantine Port,국제항로에서 입항선박에 대한 검역을 실시할 수 있는 항구
검유 탱크,Observation Tank, Inspection Tank,가열증기의 드레인에 기름이 함유되었는지를 검사하는 탱크
검인,Proof Mark,배의 기기류와 기타 비품 등을 검사하여 합격된 것을 표시하는 마크
겉보기 파고,Appearamt Wave Height,파도의 꼭대기와 바닥 사이의 수직높이
겉보기 파도주기,Appearant Wave Period,파도의 정점이 선수를 지날 때와 다음 파도의 정점이 지날 때 사이의 걸리는 시간
겉칠,Final Coating,밑칠 중간칠을 마친 후 마지막으로 바르는 칠
게가공선,Crab Factory Ship,포획한 게를 해상에서 직접 가공하는 설비를 갖춘 배
게이지,Gauge, Gage,검사할 때 사용하는 도구로 다이얼 게이지, 블록 게이지, 틱크니스 게이지, 리밋 게이지 등이 있음
게잡이 모선,Crab Mother Ship,게잡이 소형선을 거느리며 잡은 게를 모으고 필요 물자를 공급하는 모선
게조,Slack Water,밀물과 썰물 사이에 나타나는 흐름이 멈춘 상태로 하루에 4회 나타남
격납상자,Magazine,구명정의 부속용품, 방화용 모래, 기타 공구 등을 담아두는 상자
격납용기,Containment Shell(Vessel),원자력선에서 원자로를 둘러싼 용기로, 방사능의 누출을 막기 위한 것으로 선체와 별개로 된 것과 일체로 된 것이 있음
격벽,Bulkhead,배안의 공간을 가르는 벽으로, 횡벽, 종벽, 수밀벽, 기밀벽, 유밀벽, 비수밀벽 등 다양함
격벽 라이너,Bulkhead Liner,격벽 플랜지와 외판 사이의 라이너
격벽 스툴,Bulkhead Stool,창내 격벽의 상부 또는 하부에 설치되는 호퍼모양 또는 상자모양의 구조
격벽 패킹박스,Bulkhead Stuffing Box,수밀격벽의 축(Shaft) 관통부에 설치되는 물막이 패킹 상자
격벽갑판,Bulkhead Deck,선수격벽과 선미격벽 사이의 횡격벽이 미치는최상층의 전통갑판(통상 상갑판)을 일컬음
격벽골,Bulkhead Recess,격벽의 오목하게 들어간 부분
격벽관통 쇠붙이,Bulkhead Piece, Penetration Piece,갑판, 이중저, 외판 등을 파이프가 뚫고 지날 때 새지 않도록 붙여주는 쇠붙이
격벽구조도,Bulkhead Plan,격벽의 구조 부재와 배치를 나타내는 도면
격벽늑판,Bulkhead Floor,격벽위치에 있는 늑판
격자,Grating,기관실 가설통로 등에 깔리는 대발 모양의 바닥 구조물
격자 받침,Grating Bearer,격자를 지지해주는 받침구조물
겹치기 저항용접,Lap Resistance Welding,점용접, 돌기용접, 심용접 등과 같이 겹친 이음의 양쪽에서 압력을 주어 붙게 하는 저항용접
겹치기이음,Lap Joint,두 부재의 끝이 적당한 폭으로 겹치게 하여 겹쳐진 두 면 끝을 필렛용접하는 이음법
경계 와이어로프,Emergency Mooring Wire Rope,태풍 등 조난시의 계선을 위하여 비치한 와이어로프
경계등,Warning Light,위험물을 적재하거나 기름 하역 중인 선박에서 위험상태를 표시하는 적색 등으로 마스트 같은 곳에 표시함
경고 신호등,Warning Sygnal Light,다른 선박이 시야 내에서 선박의 의도를 이해할 수 없거나, 충돌예방에 필요한 거리를 유지하지 못 했을 때 이를 경고하는 신호로서 급속한 섬광을 5회 이상 보냄
경구조선,Light Scantling Vessel,중구조선보다 가벼운 구조로 된 선박
경금속선,Light Metallic Ship,경금속으로 건조한 선박으로, 선체중량 감소를 위하여, 선체나 상부구의 전부 또는 일부를 알루미늄 등의 경금속으로 구성함
경배선,Whale Back Vessel,거북등 갑판으로 된 선박으로 갑판과 외판이 둥글게 연결되고 시어(Sheer)가 없음
경보장치,Alarm System,선내의 비상상태를 사람에게 알리기 위하여 내는 소리, 빛 등의 신호
계류,Mooring,운항 하는 배를 일시적으로 묶어두는 것
계류 독,Wet Dock,간만의 차가 심한 수로에서 간조시에 수로 입구를 막아 배가 떠있도록 한 독
계류 부이,Mooring Buoy,항내에 계류용으로 띄워두는 부이
계류 윈치,Mooring Winch,횡축의 드럼에 계류 와이어를 감거나 풀어주는 윈치
계류 파이프,Mooring Pipe,계류 와이어가 지나도록 뚤린 불워크에 붙여준 파이프
계류시운전,Basin Trial, Mooring Trial,배를 계선한 상태로 주기를 작동하는 시운전
계류장치,Mooring Equipment,계류용 와이어를 감거나 풀어주는 장치로 대형선에서는 계류윈치, 소형선에서는 캡스턴이 사용됨
계선,Lay-up,선박을 장시간 쓰지 않고 매어둠
계획만재흘수,Designed Load Draught,미드쉽(Midship)에서, 용골 상면에서 계획만재흘수선 까지의 수직거리
고깔형 통풍통,Cowl Head Ventilator,화물창이나 기관실의 자연통풍에 사용되는 고깔 모양의 통풍통
고스큐 프러펠러,Heighly Skewed Propeller : HSP,프로펠러의 스큐각이 일반적으로 날개사이각의 50% 이상인 프러펠러
고온부식,High Temperature Corosion,연료에 포함된 바나듐 나트륨 등 고윤점물질에 의해 보일러의 과열기나 디젤의 배기밸브등 고온부재에 발생하는 부식
고정 원현창,Non-opening Side Scuttle Fixed Light,여닫을 수 없는 원형 현창
고정식 크렌,Fixed Jib, A-frame Derrick,한 쌍의 고정된 A자형 프레임에 지지된 기중기
고정피치 프로펠러,Fixed Pitch Propeller,날개가 허브에 고정된 프로펠러
고주파 발전기,High Frequency Generator,고주파 교류전원의 발전기, 서보모터, 자이로스코프 등에 400Hz의 고주파전기를 공급함
고주파 유도용접,High Frequency Induction Welding,고주파 유도열을 이용하여 용접부를 가열 가압하여 접합하는 맞대기 또는 심용접법
고주파 저항용접,High Frequency Resistance Welding,고주파전류를 모재에 직접 공급하며 용접부를 가압하여 접합하는 맞대 기(심)용접법
고착,Fastening,구조부재를 못, 스파이크, 나사 등으로 결합시키는 것
고착 쇠붙이,Anchor Piece,동요, 진동, 팽창, 수축 등으로 인한 기기나 배관의 이격과 목갑판 등을 고착하기 위한 쇠붙이
