한글,영문,설명
초벌칠,First Coat, Prime Coat,,도장할 때 제일 먼저 칠하는 방식도장
초음파액면계,Supersonic Type Level Gauge,초음파의 반사시간에 의하여 액면의 위치를 측정하는 계기
초음파용접,Ultrasonic Welding,초음파를 발생하는 두 개의 진동음극 사이에 접합재를 끼우고 압력을 가하여 접합하는 용접법
초음파유량계,Supersonic Type Flow Meter,유속에 따라 음파의 전파시간이 변하는 것을 이용하여 유량을 측정하는 계기
초음파탐상기,Ultrasonic Reflectoscope, Ultrasonic Detector,초음파를 이용하여 물체내의 결함을 검사하는 비파괴 검사장치, 펄스반사법, 투사법, 공진법 등이 있음
초음파탐상시험,UT : Ultrasonic Test,초음파를 이용하여 구조물 내부의 결함을 찾아내는 시험방법으로 초음파가 어떤 재질을 투과할 때 이물질과의 경계에서 반사되어오는 성질을 이용하여, 시간과 강도로서 결함의 위치, 크기 및 깊이 등을 추정함
촉,Chock,배가 동요할 때 선상의 물체가 움직이지 않도록 받쳐주는 나무토막, 갑판이나 독에서 로프와 체인 등을 유도하는 데 쓰이는 금속 또는 나무 테
총적량,Gross Capacity,적량합계에서 갑판이상의 추진, 항해, 위생, 안전 등에 관한 공간을 제외한 적량
총조립,Grand Assembly, Pre-erection, Pre Erection : PE,선탑재, 선행탑재 등과 같음
총톤수,Gross Tonnage,배의 총적량을 용적톤수로 나타낸 값, 배의 크기를 나타냄
최고전압,Maximum Voltage,정상적 가동상태에서 나타나는 최고전압
최대사용압력,Maximum Working Pressure,압력용기나 유체기구가 연속적으로 안전하게 사용할 수 있는 최대압력
최대속력,Maximum Speed,주기의 최대과부하출력으로 배가 낼 수 있는 가장 빠른 속력
최대수선면,Maximum Waterplane,수선면적이 최대가 되는 흘수에 해당되는 수선면
최대연속정격출력,Maximum Continuous Rating : MCR,선박에 설치된 주기를 연속적으로 안전하게 발생시킬 수 있는 최대출력
최대연속회전수,Number of Maximum Continuous Revolution,최대 연속 출력기관의 회전수
최대정지거리,Head Reach,배가 정상속도로 직행하다가 비상정지(역추진 또는 급선회)시킬 때 전진한 최대거리(정지 전의 직선항도와 평행한 직선성분거리)
최대폭,Extrame Breadth, Maximum Breadth,배의 가장 넓은 곳에서 잰 양현외면 간의 수평거리
최대횡단면적,Maximum Transverse Section,선체횡단면의 수선 아래면적 가운데 가장 큰 값
최대흘수,Extrem Draught, Extreme Draft,수선길이의 중앙점에서, 용골바닥부터 만재흘수선까지의수직거리
최상선교,Flying Bridge,선교상층의 노천항해갑판, 선교의 보조역할을 함
최상전통갑판,Uppermost Cotinuous Deck,선수에서 선미까지 뻗은 갑판 중에서 최상층의 갑판
최소건현,Minimum Freeboard,법적으로 허용되는 최소 한도의 건현
최소탐지거리,Minimum Drtectable Range,레이더의 펄스 길이, 송수신 변환기의 회복시간, 배의 크기 등에 따라서 가까운 표적물이 분리 표시되지 못하는 한계거리
최저속,Dead Slow,적당한 시간 동안 주기가 낼 수 있는 최저회전수에서 배가 내는 속력
최저속안전운항,Heave-to,해상상태가 극히 나쁠 때 선박의 안전을 위하여 최저속력으로 운항하는 항법
최저조타속력,Steerage Way,조타가 가능한 최저전진속럭
최저회전수시험,Minimum Revolution Test,디젤기관에 대하여 안전하게 돌릴 수 있는 최저회전수를 확인하는 시험
최접근점,Closest Point of Approach :CPA,자기 배가 다른 물체와의 상대운동 중 가장 접근하는 점
최종강도,Ultimate Strength,구조물이 견디는 최대하중
추력,Thrust,추진기로 발생시킨 축방향의 힘
추력감소율,Thrust Reduction Fraction,자항상태의 선박에서 프로펠러가 발생시킨 추력과 그 속도에서 걸리는 선체저항과의 차이를 추력으로 나타낸 값, 추력감소계수와 동일
추력마력,Thrust Hosepower, Useful Hosepower,프로펠러에서 발생된 추력을 마력으로 나타낸 것
추력받이,Thrust Pad,추력베어링의 칼라에 끼우는 부채꼴 모양의 패드, 베어링합금으로 제작되어 윤활상태에서 높은 압력전달이 가능함
추력받이칼라,Thrust (Shaft) Collar,프로펠러에 발생한 추력을 추력베어링에 전달하기 위해 추력축과 일체로 된 칼라
추력베어링,Thrust Bearing,프로펠러의 추력을 받아서 선체에 전달하는 베어링, 주기 또는 감속기에 조립됨
추력볼베어링,Ball Thrust Bearing,추럭을 전달하는 볼베어링
추력블록,Thrust Block,추력베어링과 동일
추력블록받침대,Thrust Block Seat,추력베어링을 지지하는 받침대로서, 모든 추력이 베어링에 전달되므로 매우 견고한 구조로 됨
추력상실,Thrust Breakdown,일반프로펠러에 과도한 캐비테이선이 발생하여 추력에 손실을 입는 현상
추력축,Thrust Shaft,프로펠러의 추력을 선체에 전달하는 축
추선,Plumb Line,추를 매달아 연직선을 재는 줄
추적,Tracking,레이더파의 빔 또는 광학장치의 + 표시선이 이동하는 목표를 좇아가게 하는 것
추진,Propulsion,물체를 밀어서 움직이게 하는 것
추진보기,Propulsion Auxiliary Machinery,주기를 구동하는 데 직접 필요한 보조기계
추진출력,Thrust Output, Thrust Hosepower,추진기가 배를 미는 출력
추진효율,Propulsive Efficiency,주기관의 유효동력과 추진장치에 전달된 동력의 비
추파,Following Sea,배의 진행방향과 입사파의 진행방향이 같거나 거의 비슷한 상태
축,Shaft,회전운동체의 중심축을 형성하는 기계요소
축 전달효율,Shafting Efficiency,프로펠러에서의 전달동력과 축동력의 비
축각,Shaft Angle,축의 중심선과 선체중심선 또는 기저면과 이루는 각
축경사,Shft Rake,선체기선에 대한 축의 기울기
축계,Shafting,추진기관에서 프로펠러에 이르는 추력전달 축의 총칭
축계비틂 진동시험,Tortional Vibration Test,주기를 최저회전부터 최대회전까지 서서히 변화시키면서 축계의 비틂진동을 계측하고 위험진동수를 조사하는 시험
축계장치도,Shafting Arrangement,축계를 구성하는 축, 베어링, 선미관, 프로펠러 등을 기능적으로 배열한 장치를 나타내는 도면
축계접지장치,Shaft Grounding Device, Shaft Earthing Device,축과 선체 간의 전위차를 없애기 위하여 양쪽을 도선으로 연결하는 것(전기적부식방지)
축계정열,Shaft Alignment,축계장치에서 축의 휨, 베어링 하중 등을 고려한 배치상태
축관,Shaft Tube,선미관과 동일, 선체와 선미격벽을 관통하는 주철 또는 주강제의 관
축기진력,Shft Force, Bearing Force,프로펠러축을 통하여 선체에 전달되는 프로펠러 기진력 성분
축동력,shaft Power,추진기관에서 축에 전달되는 동력, 축의 후단에서 계측함
축라이너,Shaft Liner,축과 상대운동이 이루어지는 부재 사이의 마모를 줄이기 위해 끼우는 원통형의 금속
축로,Shft Tunnel, Shaft Trunk,추진축계를 보호하기 위하여 기관실 후단에서 선미까지 터널모양으로 설치된 수밀구획
축류송풍기,Axial Blower,바람날개를 돌리는 축과 같은방향으로 바람이 흐르게 하여 공기를 밀어 보내는 형의 송풍기
축류압축기,Axial Compressor,축류송풍기와 같은 구조로 되어있는 공기압축기
축류터빈,Axial Flow Turbine, Parallel Flow Turbine,터빈 내의 증기흐름 방향이 터빈의 축방향과 같은 터빈
축류펌프,Axial Flow Pump,축류송풍기와 같은 구조로 되어있는 송풍기
축마력,Shaft Hosepower,축동력과 같음
축베어링,Shaft Bearing,회전운동이나 직선운동을 하는 축을 지지하는 베어링
축분리운전시험,Shaft Cut-off Test,축이 두 개이상인 선박에서 임의의 축을 분리 또는 고정한 상태에서 성능을 확인하는 시험
축브래킷,Shaft Bracket,선체 밖으로 돌출된 프로펠러를 선체와 연결하여 지지해 주는 부재
축브레이크,Shaft Brake,동력전달축의 회전을 줄이거나 멈추게 하는 장치
축슬리브,Shaft Sleeve,해수접촉을 막기 위해 축에 씌우는 덮개
축심깊이,Shaft Immersion,수면에서 프로펠러축까지의 수직깊이
축심투시,Shaft Center Sighting,기관실전부격벽과 선미재보스의 선미축구멍을 중심으로 축심을 정하고 이를 투시하여 사이에 놓일 기관, 감속기, 축베어링, 추진축 등의 위치와  보링중심위치 등을 정하는 작업
축열식열교환기,Heat Regenerator, Regenerative Heat Exchanger,벽돌, 자갈, 금속 등을 고온유체로 가열시켰다가 이를 다시 가열시킬 유체와 접촉시켜 열을 전달하는 방식
축전기,Condenser, Capacitor,장전용량에 따라 전기를 축적하는 기기
축전지,Storage Battery, Accumulator,충전과 방전을 가역적으로 하고 전력을 축적하거나 방출할 수 있는 전지
축지지브래킷,Shaft Bracket,축브래킷과 동일
축척비,Scale Ratio,기하학적 모양은 같으나 크기가 다른 두 개의 물체에 대한 크기비율, 실선과 모형선의 길이비율 등
축척현도,Contracted Mould,광학마킹 등에 사용하기 위하여 축소하여 그린 현도
축척효과,Scale Effect,척도효과와 동일
축출력계,Shaft Output Meter,축의 비틀림각과 회전속도 등을 측정하여 축의 출력을 알려주는 계기, 축마력계와 동일
축커플링,Shaft Coupling,축과 축을 연결시켜주는 커플링
축콘파트,Shaft Cone Part,축 끝에 프로펠러나 커플링 등을 끼우기 위해 테이퍼 가공한 원뿔모양 부분
출거,Out-docking, Docking Out,배를 독 밖으로 내보내는 것
출력,Output,원동기가 단위시간에 내는 동력
출범기,Blue Peter,국제신호기의 문자기이며, 본선출항, 전원귀선을 알리는
출하,Shipment,화물을 선적하여 발송하는 행위
출항허가,Sailing Permit,국제항로선박이 출항할 때 세관에서 받는 허가, 항구를 떠나기 전에 관계기관에서 받는 허가
충각,Ram,적함에 충돌하여 손상을 주려고 함정의 선수부 수선하에 붙인 뿔, 램과 동일
충격,Impulse,극히 짧은 시간에 힘이 작용하는 현상
충격렌치,Impact Wrench,압축공기 등으로 연속적인 충격을 주어 너트를 잠그거나 풀어주는 공구
충격부식,Impingement Corrosion,금속표면이 반복되는 충격에 의해 몹시 소모되는 현상
충격시험,Impact Test, Percussion Test,시험편에 충격하중을 가해서 차단되었을 때 흡수된 에너지를 측정하는 시험으로, 이것으로 재료의 인성과 취성을 판단함
충격시험기,Impact Testing Machine,재료의 인성과 취성을 판단하기 위한 시험장치, 장비의 충격에 대한 안정성을 시험하는 장치
충격용접,Percussion Welding, Percussive Welding,용접면을 맞대고 아크를 발생시켜 용융상태에 이를 때 충격을 주어 용착시키는 방법
충격적 경도시험기,Impact Hardness Testing Machine,하중을 충격적으로 가하여 경도를 측정하는 시험기
충기시험,Air Charging Test,충기장치가 되어있는 소형 디젤엔진의 충기능력, 밸브의 작동, 내구력 등을 확인하는 시험, 공기압축기의 충기능력을 확인하는 시험
충돌예방등,Anti-collision Light,대형탱커 등의 중앙부에 소형선박이 야간에 충돌하지 않도록 갑판위에 설치하는 발광등기구
충돌예방장치,Anti-collision System,레이더정보를 처리하여 배의 충돌을 막는 데 필요한 데이터를 표시하는 장치
충방전배전반,Charging Switchboard,축전지전원의 충전과 방전을 제어하는 배전반
충전장치,Charging Equipment,축전지에 충전을 하기 위한 장치
취성파단,Brittle Fracture,재료가 뚜렷한 소성변형이 없이 깨어지는 형식의 파괴
측갑판실,Side House,선체중심에서 현측으로 떨어진 위치의 갑판실
측거기,Range Finder,거리를 측정하는 기계, 광학식과 전파식 등의 있음
측거더,Side Girder,중심선거더와 연판 사이에 설치되는 종통판재
측내용골,Side Skelson,단저구조에서 선체중앙선에 평행하고 늑판에 직교하게 설치되는 형강 또는 판재
측도갑판,Tonnage Deck,적량측도의 기준이 되는 갑판
측량선,Surveying Ship,수로측량에 종사하는 선박
측류청정,By-pass Purifying,순환중인 윤활유의 일부를 청정기와 여과기 등에 도입하여 서서히 청정하는 방법
측면 필릿용접,Fillet Weld in Parallel Shear, Side Fillrt Weld,용접선의 방향이 구조의 전달응력과 평행하게 진행되는 필릿용접
측면굽힘 시험편,Side Bend Specimen,용착부의 측면강도를 시험하기 위해 측면으로 굽히는 시험편
측면도,Profile, Side Elevation,선체 또는 물체를 수직평면에 투영한 도면
측면선도,Sheer Plan,선체중심면과 여기에 평행한 단면들이 선체표면과 교차하여 생기는 곡선들을 모아서 나타낸 선도
측심,Sounding,수심을 측정하는 것, 탱크 안의 물이나 기름의 깊이를 측정하는 것
측심기,Sounding Machine, Fathom-meter,수심을 측정하는 기계, 추를 달아내리는 방식과 초음파의 반사를 이용하는 방법 등이 이용됨
측심대,Leadman`s Platform,수동식 측심추를 달아내리는 사람이 설 수 있도록 뱃전에 설치한 보호발판
측심봉,Sounding Rod,탱크 내의 액면을 재기 위한 기구
측심연,Sounding Lead,측심줄 끝에 달린 납으로 된 추로, 무게는 3kg, 5kg, 7kg 등이 있음
측심줄,Lead Line,측심추를 달아내리는 줄로, 1m 또는 3m마다 눈금이 표시됨
측심추,Hand Lead,측심연이 달린 측심줄을 함께 부르는 호칭
층,Layer,용접의 패스로 형성된 용착금속 층
치수계수,Scantling Number Scantling Numeral,선급의 구조규칙에 따라 부재치수를 산출할 때 쓰이는 수치
치수조정관,Adjustable Pipe, Loose Pipe,선각블록을 연결할 때 설치된 관 끼리의 연결맞춤을 위하여 두었다가 나중에 끼워 맞추는 관 토막
치수효과,Size Effect,치수에 따라서 재료의 기계적 성질이 달라지는 것
치핑,Chipping,금속을 끌로 깎아내는 것
치핑 해머,Chipping Hammer,용접 시에 슬래그 및 스패터의 제거, 용착금속의 열간충격, 용접홈의 정리 등 다목적으로 쓰이는 금속으로 된 뾰족한 모양의 손 망치
친항성,Sea Kindness,항해중의 동요로 발생하는 슬래밍, 갑판침수, 승무원의 안락감, 저항증가, 추진기 공전 등에 대한 배의 성능
칠땜질,Touch Up,부분적인 도장누락이나 피막손상 등을 보수하는 도장
침로,Course,배가 향하는 방향 또는 항로
침로안정성,Course Stability, Directional Stability,배가 항진 중 외력으로 침로를 벗어났다가도 외력이 없어지면 다시 침로로 돌아오는 성질
침로유지선,Burdened Vessel,두 배가 마주보고 접근할 때, 자기 항로와 속력을 변하지 않고 유지할 의무가 있는 배, 다른 배가 피해야함
침소식아세틸렌가스발생기,Carbide to Water Gas Generator,카바이드를 물에 침적시켜 아세틸렌가스를 발생시키는 장치
침수,Flood,선체의 충돌, 좌초 등으로 선각의 일부가 파손되어 수밀구역에 물이 들어오는 상태
침수계산,Flooding Calculation,배가 손상되어 침수되었을 때의 여러 가지 경우에 대한 선체복원성과 자세 등을 계산하는 것
침수구획,Bilged Compartment,선체 일부에 손상을 입어 물이 들어온 구획
침수면적,Area of Wetted Surface, Wetted Surface Area,수선 하부의 선체 표면적
침수부최대폭,Immerged Maximum Beam,수선면 아래 선체의 최대폭
침수상태,Flooded Condition, Riddled Condition,선체손상으로 일부구획이 침수된 상태
침수시험,Flooding Test,선체의 수면아래 구획에 해수를 채워서 누수여부를 확인하는 시험
침수율,Permeability,침수구획에서 물이 차지한 용적과 나머지 용적의 비
침식,Corrosion,물과의 마찰이나 물의 충격이 계속되는 금속표면의 부식현상
침전탱크,Settling Tank,기름속의 고체입자나 물을 깔아 앉히기 위해 담아두는 기름탱크
침탄,Cementation,강재표면의 탄소함유량을 증가시키기 위해서 적당한 화로에서 가열한 후 냉각시키는 표면경화 열처리방식
침탄강,Cemented Steel, Blister Steel,침탄처리된 표면경화강재
침탄법,Cementation Process,탄소량이 0.18% 이하인 저탄소강을 침탄제 안에서 고온가열하여 표피에 탄소를 침입시켜 고탄소강으로 마드는 열처리과정
침투(액)탐상시험,PT : Penetration (Liquid)Test,구조물 표면의 미세결함을 찾기 위하여 침투력이 강한 유색(형광) 침투액을 도포한 후 닦아내면 잔류 침투액이 결함부에서만 표출되는 성질을 이용하여 결함의 유무를 판별하는 검사방법
침하쐐기부,Immersed Wedge,선체가 배수량 변화없이 경사되었을 때 새로이 수면에 잠기는 선체부분
카고매니폴드,Cargo Manifold, Loading Station,유조선의 현측에 설치하는 화물유관과 육상송유관의 연결부
카고포트,Cargo Port, Side Port,현측에서 화물을 직접 적재, 하역하기 위해 설치한 개구부(Opening)
카누,Canoe,통나무를 파내서 만든 작은 배, 가늘고 길며 앞쥐가 뾰족한 작은 배의 통칭
카운터선미,Counter Stern,순양함 선미, 뒤가 둥글게 많이 튀어나온 형의 선미
카운터싱킹,Counter Sinking,리벳이나 볼트구멍의 모를 죽여 접시모양으로 깎아 내는 것
칸막이벽,①Screen Bulkhead ②Partition Wall, Division Wall,①구역 간의 칸막이가 되는 경구조의 벽 ②방의 칸막이 벽
칼라,Collar,축에 테를 두른 것처럼 튀어 나온 부분
칼라스러스트베어링,Collar Thrust Bearing,추진축의 칼라와 맞닿아서 마찰을 줄이면서 추진력을 전달 받아서 선체에 전하는 베어링
칼라판,Collar Plate,형재가 판재를 관통할 때 뚫어주는 슬롯구멍 등을 부분적으로 메우기 위해 붙이는 판조각
칼로리,Calorie,물 1g의 온도를 1기압하에서 섭씨 1도 높이는 데 필요한 열량
칼링,Carling, Carlin,갑판보강을 위하여 갑판 하부에 종방향으로 붙이는 짧은 거더
캐비테이선,Cavitation,유체속을 빠르게 움직이는 물체표면에 생기는 증기방울현상으로, 물체 모양에 따라 압력이 낮아지는 표면에서 유체가 증발하여 기체화된 현상임
캐비테이션반류,Cavitation Wakes,유체속을 빠르게 움직이는 물체 뒤에서 형성되는 난류보텍스 중심의 낮은 압력장에서 발생하는 캐비테이선
캐비테이션손상,Cavitation Damage,캐비테이션이 일어나는 표면에 생기는 표면침식과 재질악화 등의 손상
캐비테이션제어,Cavitation Control, Submergence Control,복수기의 액면유지를 위하여 복수펌프에 장애가 생기지 않을 정도의 캐비테이션을 주어 유량을 조절하는 방법
캐비테이션탱크,Cavitation Tank,프로펠러의 캐비테이션 상황을 관찰하기 위하여 설치한 수조시험장치, 시험을 통하여 추력과 토크 등도 계측함
캐비티,Cavity,캐비테이션에 의해 유체속에서 생긴 증기방울
캐비티저항,Cavity Drag,캐비티를 형성하는 데 소요된 에너지로서, 물체에 작용하는 저항으로 나타남
캐스케이드용접,Cascade Welding Sequence,다층용접에서 용접선의 중앙부터 양쪽 끝을 향해 층을 쌓아 가는 방식
캐스케이드탱크,Cascade Tank, Feed Water Filter Tank,보일러에 급수되는 복수에 유분을 걸러내는 여러 칸으로 된 탱크
캐터펄트,Catapult,길이가 짧은 갑판에서 비행기를 발진시킬 때, 증기나 화약으로 기체를 추진시키는 발사대
캔버스,Canvas,범포, 마나 목면, 합성섬유 등으로 짠 두꺼운 직물
캔버스보트,Canvas Boat,캔버스로 만든 보트
캔버스호스,Canvas Hose,캔버스로 된 호스
캔트늑골,Cant Frame,가로와 세로방향에 대하여 각도를 가지며 방사상으로 배치되는 선미부의 외판 늑골
캔트보,Cant Beam,가로와 세로방향에 대하여 각도를 가지며 방사상으로 배치되는 선미부의 갑판 보
캘리퍼스,Calipers,봉의 바깥지름, 구멍의 안지름, 틈새의 크기, 판의 두께 등을 재는 공구
캠,Cam,직선 왕복운동이나 회전운동을 이용하여 종동축에 필요로 하는 위치, 속도 및 가속도가 가해지도록 특수한 기하학적 모형으로 만든 구동축 부재
캠버,Camber (of Beam), Round-up of Beam,노출갑판의 배수를 위하여 갚판 중앙부를 솟게 만든 것, 배수를 위하여 도로 복판을 솟게 만든 것
캠버곡선,Camber Line,갑판의 캠버를 나타내는 횡단면곡선
캠축,Cam Shaft,캠이 붙여진 축
캡너트,cap Nut,한 쪽이 막힌 덮개형 너트
캡스턴,Capstan,수직축 드럼으로 계류용 로프를 감아 들이는 장비
캡스턴막대,capstan Bar,캡스턴을 인력으로 돌릴 때 꼽아 쓰는 지레막대
캡타이어전선,Cabtyre Cable,피복전선의 겉을 다시 강력한 캡타이어 고무로 피복한 전선, 아크용접기 등 이동이 빈번한 전기기기에 전원공급선으로 사용됨
커터리스펌프준설선,Suction Drdger,커터가 없이 해저의 토사를 그대로 빨아올려 배출하는 준설선
커튼판,Curtain Plate,갑판의 내다지 끝에 붙이는 테돌림 좁은 판
커프,Kerf,흠집자국
커플링,Coupling, Joint,축이나 관을 연결시키는 것
커플링플랜지,Coupling Flange,축이나 관을 연결하는 데 사용하는 플랜지
컨베이어,Conveyor,연속적인 움직임으로 물품을 운반하는 장치
컨테이너고박장치,Container Lashing Equipment,갑판상에 적재한 컨테이너를 고정하는 장치
컨테이너냉동기냉각수펌프,Container Refrigerator Cooling Sea Water Pump,컨테이너 냉동기 청수 냉각기에 해수를 보내는 펌프
컨테이너선,Container Ship,규격화된 컨테이너를 전문으로 운송하는 선박
컴패니언,Companion (Way),갑판에 설치된 계단을 위해 마련한 출입구 공간실
컴퍼스(제도용),Compasses,원을 그릴 때 사용하는 제도용구
컴퍼스(항해용),Compasses,선박의 침로나 표적물의 방위를 측정하는 기구
컴퍼스갑판,Compass Deck,자석식 컴퍼스가 설치된 최상층의 갑판
컴퍼스볼,Compass Bowl,자기컴퍼스의 북극 지시기구를 내장한 용기
컴퍼스선교,Compass Bridge,기준컴퍼스가 설치된 선교
컴퍼스수정사,Compass Adjuster,자기컴퍼스의 자차수정을 하는 직업인
컴퍼스오차,Compass Error,자기컴퍼스가 가리키는 자북과 진북의 각도차
컴퍼스침로,Compass Course,컴퍼스가 지시하는 북쪽방향과 배의 진행방향이 이루는 각
컴퍼스카드,Compass Card,컴퍼스의 방위눈금을 기록한 문자판
컴퓨터이용공정계획,Computer Aided Production Planning : CAPP,전산시스템을 이용한 생산공정의 분석과 생산실행을 위한 계획을 수립하는 체계, CAD, CAM 등과 연계됨
컴퓨터이용생산관리시스템,Computer Aided Production Management System : CAPM,생산에 필요한 자원들(인력, 자재, 장비사용 등)을 공정에 따라 시간축으로 배열하고 시뮬레이션을 통한 최적값을 찾아 이를 기본으로 공정진행을 관리하는 생산경영체계
컴퓨터이용생산시스템,Computer Aided Manufacturing System : CAM,CAD에서 얻어진 정보를 이용하여 생산장비를 제어하거나 조작하는 전산체계, 선박생산 자동화의 근간이 됨
컴퓨터이용설계시스템,Computer Aided Design System : CAD,선박제품 정보를 생성, 저장, 분석하고, 효율적인 전달을 위한 통합 생산체계의 시발과 중심이 되는 시스템
컴퓨터통합제조시스템,Computer Integrated Manufacturing System,설계에서 제품생산에 이르는 전 과정이 컴퓨터를 통하여 자동화/통합화되어 제조관리를 효율적으로 운영할 수 있는 생산종합관리시스템
컷아웃,Cutout,어떤 회로나 통로를 차단시키는 것, 부재의 일부를 잘라 내는 것
컷오프,Cutoff,증기, 공기 또는 유체의 공급을 정지하는 것
케미컬클리닝펌프,Chemical Cleaning Pump,열교환기 등의 내부세척을 위해 약물세척액을 순환시키는 펌프
케이(K)형홈,Double-bevel Groove, K Groove,맞대기용접에서 두 부재의 접합면을 K 모양으로 가공한 것
케이블걸이,Cable Hanger,전선을 걸어두기 위한 장치
케이블길이측정장치,Cable Length Measuring Device,풀어낸 케이블의 길이를 측정하는 장치
케이블덕트,Cable Duct,노출갑판이나 위험장소를 통과하는 케이블의 보호를 위하여 설치하는 덕트
케이블드럼,cable Drum,케이블 가설선의 케이블을 감아두는 드럼
