한글,영문,설명
어큐뮬레리터,Accummulator,펌프에서 발생한 압력에너지를 축적하였다가 필요에 따라 기계를 작동시키는 장치
어획물운반선,Fish Carrier,잡은 고기를 운반하기 위하여 냉동, 냉장 및 활어설비를 갖춘 운반선
언더컷,Undercut,용접 가장자리에서 모재가 녹으면서 패인 부분이 용착재로 덮이지 못해 나타나는 홈
얼리지,Ullage,탱크 내 빈공간의 용적
얼음떨기,Deicing,레이더 안테나에 부착된 얼음을 떨어 내는 것
얼음앵커,Ice Anchor,극지방에서 빙판에 박는 쇠말뚝(닻 대신에 이용)
엄빌리컬 케이블,Umbilical Cable,잠수선이나 다이빙벨과 지원선을 연결하는 케이블로 이것을 통하여 전력공급, 통신 등이 이루어짐
업셋용접,Upset Welding,저항용접의 일종으로 마주보는 연결부에 전류를 통하여 저항열에 의해 용융점에 도달되면 압력을 가하여 접합시키는 용접방법
엇갈린 띠엄 필렛용접,Zig-zag Fillet Welding, Staggered Intermittent Fillet Weld,T형 이음의 양면에 띠엄 필렛용접을 할 때 마주보는 용접 비드가 서로 교차하도록 하는 용접법
엇갈림관배치,Staggered Lauout,보일러 열교환기 등 관의 전열효과를 높이기 위하여 관을 서로 마주보지 않도록 엇갈리게 배치하는 것
에너지,Energy,일을 할 수 있는 능력, 열, 전기, 위치, 화학, 원자력 등 다양한 에너지가 있음
에보나이트,Ebonite,생고무를 유황으로 유화시킨 흑색물질로 내산성, 내알칼리성, 절연성이 좋아  절연물이나 화학기구에 사용됨
에어갭,Air Gap,두 물체간의 간격, 자기회로의 공기틈새, 전극간의 불꽃간격
에어러포일,Aerofoil,에어포일과 같음
에어벤트,Air Vent,탱크 내의 압력상승을 막기 위하여 공기를 빼주는 관
에어콕,Air Cock,액체나 가스의 용기 또는 배기관 등에 공기를 뽑거나 넣어주기 위해 달린 콕
에어포일,Airfoil,유체가 흐름 중에 놓였을 때 항력보다 큰 양력을 받도록 붙인 날개
에어휘슬,Air Whistle,압축공기의 방출로 소리나게 하는 장치
에이중유세틀링탠크,Diesel Oil Settling Tank,A중유의 불순물을 침전시켜주기 위하여 머물게하는 탱크
에이티시험,AT : Appearance Test,외관검사 참조
에이프런,Apron,철도연락선의 차량갑판과 부두의 안벽을 연결하고 높이를 조절하는 철제 다리
에칭,Etching,금속조직을 현미경으로 관찰하기 위해서 표면을 연마하고 약품으로 부식시켜 온전한 결정모양이 들어나도록 하는 것
에프피에스오선,FPSO : Floating Production Storage Offloading Vessel,석유의 시추와 생산, 저장, 및 하역을 해상에서 하면서 이동할 수 있는 기동력과 경제성이 강한 다기능 석유생산선박으로, 고유가시대에 맞추어 등장함
엔드탭,End Tab, Run-off Tab,아크용접시에 용접선의 끝과 시작점에 임시로 붙이는 보조판으로, 이부분에서 생기기 쉬운 용접결함이 본용접선에서 생기지 않도록 하고 뒤에 떼어냄
엔디이,NDE : Non-destructive Evaluation,비파괴시험 참조
엔디티,NDT : Non-destructive Test,비파괴시험 참조
엔트로피,Entropy,열역학 용어로 열이동에 따라 유효하게 사용할 수 있는 에너지감소를 양으로 나타낸 값을 말함
엘보,Elbow,관이 꺾이는 부분에 붙이는 이음관으로, 원하는 각도만큼 굽혀져 있으며, 경이 큰 관에는 엘보 대신 벤트라는 이음관이 이용됨
여객선,Passenger Boat,여객운송에 종사하는 배, 12명 이상의 여객정원을 가진 배(SOLAS 및 선박안전법)
여객설비,Passenger Accommodation,여객선에서 여객의 안락한 거주를 위해 마련하는 거주, 위생, 공기조화 등의 설비를 지칭함
여객안전증서,Passenger Ship Safety Certificate,SOLAS에 가맹한 국가간 항해여객선에 발급되는 증서로 여객선이 안전규정에 합격되었음을 증명하는 것임
여과기,Strainer, Strrm Box, Rose Box,관계통의 흡입구에 설치되어 흡입유체중에 섞여있는 불순물을 걸러주는 장치
여닫이문,Hinged Door,돌저귀가 달린 문
역극성,Reversed Polarity,직류아크용접에서 모재를 음극으로 하는 접속법
역극성 용접,Reverse Polarity Welding,직류 아크용접에서 피용접물을 음극으로, 용접봉을 양극으로 연결하는 용접법
역나선형조종시험,Reverse Spiral Maneuvering Test,선회각속도가 일정하게 타를 틀어 배의 선회안정성을 조사하는 시험
역류열교환기,Counterfiow Heat Exchnger,고온유체와 저온유체가 서로 역방향으로 흐르는 열교환기
역방향 용접,Backstrap Welding,용접 길이를 토막내어 용접 진행방향과 반대로 용접하여 이어나가는 용접법, 용접에 의한 응력과 변형을 줄이기 위한 방법
역전,Reverse,정상에 대하여 반대방향으로 운전(회전)하는 것
역전기관,Reversible Engine,역전장치 없이 역전이 가능한 기관
역전시험,Reversing Test,기관의 역전성능시험
역전장치,Reversing Gear,회전이나 전진운동의 방향을 반대방향으로 변환시커주는 장치
역전클러치,Reversing Clutch,주축의 회전방향은 바뀌지 않고 연동축의 방향만 반대로 바꿔 주는 장치
역청시멘트,Bituminous Cement,역청질 유제쇄석과 혼합된 시멘트, 포장재로 사용
역청에나멜,Bituminous Enamel,피치나 탈 등을 원료로 하는 에나멜로 내약품성이 뛰어남
역파,Cross Sea,바람과 반대로 진행하는 불규칙파
역화,Back Fire, Flash Back,①가스용접이나 가스절단시에, 잘못하여 불꽃이 갑자기 팁 안으로 역행하는 현상, ②가스불꽃 토치에서 불꽃이 토치 안으로 역류하는 것
연강,①Ductile Steel, ②Mild Steel,①연성(늘어나는 성질)이 높은 철강, ②탄소함량이 0.15~0.20%, 인장강도 38~40kg/mm2인 철강재료로 구조물에 가장 많이 사용됨
연결관,Interconnection Pipe,두 개의 관계통을 연결시켜주는 관
연결함,Junction Box, Joint Box,다심전선을 연결할 때 결선보호를 위해서 설치하는 철제나 플라스틱제의 상자
연관식화재경보장치,Smoke Pipe Fire Alarm System,화재발생시의 연기를 감지하여 경보를 발하는 장치
연기탐지기,Smoke Detector,방화구역의 공기를 흡입하여 이중에 포함된 연기를 감지하는 장치
연납,Soft Solder,납과 주석의 합금으로 연납땜(Soldering)에 사용됨
연돌,Funnel,연로나 배기가스관 등을 내장한 통모양의 구조물, 치장연돌, 연돌의장 등으로도 불림
연돌마크,Funnel Mark,연돌에 붙인 회사마크
연돌비상차단장치,Funnel Emergency Shut-off Device,비상시에 대기와 기관실의 공기유통을 차단시키는 장치
연락교,Connecting Bridge,삼도선(Three-island Ship)에서 볼 수 있는 구조물로 선교와 선수루 또는 선미루를 이어주는 갑판상의 가교
연로,Uptake,보일러의 연소가스를 기관실 밖으로 배출하는 통로, 연돌 안에 포함된 부분은 연돌내통이라 칭함
연료,Fuel,공기 중에서 연소되어 열 또는 빛을 발생하여 이것을 여러 가지 목적으로 이용할 수 있는 가연물질
연료가스,Fuel Gas,가스상태로 쓰이는 연료
연료고,Bunker,석탄, 중유 등의 연료를 저장하는 곳
연료공급지,Bunkering Station,선박에 연료를 공급하는 항구
연료교환,Refueling,원자로에서 새로운 연료봉을 노심에 장진하는 것,
연료밸브,Fuel Valve,연료분사 밸브와 동일
연료밸브기름냉각기,Fuel Valve Cooling Oil Cooler,디젤기관의 연료밸브 냉각용 기름을 식혀주는 장치
연료분사밸브,Fuel Injection Valve,연료를 연소에 적합한 미세입자로 만들어 연소실로 분사시키는 밸브
연료소비량,Fuel Consumption,내연기관이나 보일러 등에서 일정시간에 소비한 연료의 양
연료소진,Short Bunker,항해도중에 연료가 떨어지는 것
연료유,Fuel Oil : FO,연료로 쓰이는 광물성기름, 가솔린, 등유, 경유, 중유 등이 있음
연료유분사펌프,Fuel Injection Pump,디젤기관의 연료분사밸브에 연료를 고압으로 보내주는 펌프로 주로 플런저 펌프가 사용됨
연료유블랜딩장치,Fuel Oil Blender,두 종류의 연료유를 원하는 비율로 섞어주는 장치
연료유슬러지탱크,Furl Oil Sludge Tank,연료청정기에서 배출된 기름섞인 불순물을 저장하는 탱크
연료유여과기,Fuel Oil Filter, Fuel Oil Strainer,연료유에 섞인 불순물을 거르는데 사용하는 여과기
연료유자동조절통,Automatic Fuel Oil Reservoir,가솔린기관의 기화기에 들어있는 자동조절기름통
연료유전처리시스템,Fuel Oil Pretreatment System,연료유의 수분, 침전물, 불순물 등을 제거하여 주는 선박 내의 처리장치
연료유중력탱크,Fuel Oil Gravity Tank,중력으로 연료유가 흘러가게 하는 탱크로 기관보다 높은 위치에 설치됨
연료유청정기,Fuel Oil Purifier,연료유중의 수분이나 고형물질을 제거하는 장치, 원심분리기형
연료유탱크비상차단밸브,Fuel Oil Tank Emergency Shut-off Valve,위급시에 기관실 밖에서 연료유공급을 차단하는 밸브
연마기,Grinding Machine, Grinder,가공물의 표면을 연마하는 연마기
연성,Dutility,재료가 하중을 받아 파단될 때까지 늘거나 줄어들 수 있는 기계적 성질
연소,Combustion,물질이 산소와 화합하면서 빛과 열을 발생하는 화학적 변화
연소기,Combustor,터빈에서 압축공기 흐름속에 연료를 불어 넣어 연소시켜 주는 장치
연소노킹,Combustion Knocking,노킹 참조
연소손실,Combutile Loss,불완전연소로 인한 연료손실
연소행정,Combustion Stroke,내연기관의 실린더내에서 연료가 연소되어 얻어진 고압가스가 피스톤을 밀어내는 행정
연속 필렛용접,Continuous Fillet Weld,비드를 끊지 않고 연속하는 필렛용접
연속경용접,Light Continuous Welding,모재의 두께에 비해 용착금속의 양을 줄인 연속용접, 강도를 요하지 않는 수밀용접 등에 활용됨
연속부재,Continuous Member,부재가 교차되는 곳에서 끊이지 않고 이어지는 부재, 관통부재
연속용접,Continuous Welding,비드가 끊이지 않고 이어지는 용접
연속점용접,Progressive Spot Welding, Roll Spot Welding,점용접과 같이 롤러전극을 판에 접속 회전하면서 연속적으로 점용접하는 방법
연수,Soft Water,용전염류가 적은 물
연수장치,Water Softner,경수를 연수화기키는 장치
연습선,Training Ship,항해연습에 쓰이는 배
연습선대,Training Squadron,연습생을 태우고 훈련하는 연습선의 집단
연안경비대,Coast Guard,밀무역, 밀입출국의 단속 및 해난구조, 안전항해 지원 등의 임무를 가진 해상경비부대
연안경비정,Coastal Motorboat,연안경비에 종사하는 소형선박
연안구역항행,Coasting Service,법규에 의해 연안구역으로 지정된 구역내에서 항해하는 것
연안무선국,Coast Radio Station,해안에서 해상선박들과 교신하는 무선국
연안방위함,Coast Defence Ship,연안경비를 목적으로 하는 소형 군함
연안항법,Coastal Navigation,육지에 접근해서 항해하는 항법
연어송어공장선,Saimon and Trout Factory Ship,연어와 송어 어선단을 따라서 잡힌 고기를 해상에서 가공하는 선박
연어송어잡이모선,Saimon and Trout Mother Ship,연어와 송어잡이 어선단의 모선
연직(수직)웨브,Vertical Web,격벽에 수직하게 붙은 큰 골재
연직주형(비척)계수,Vertical Prismatic Coefficient,선박의 배수용적을 그 선박의 수선면과 같은 면적과 같은 흘수를 갖는 수직주상체의 체적으로 나눈 값
연직추,Bob Weight, Plumb Bob,연직선을 알기 위하여 매다는 추
연직축프로펠러,Cycloidal Propeller, Vertical Axis Propeller,배의 밑면에 붙은 원판에 수직축 둘레로 타모양의 수직날개가 배치되어 회전하면서 자신의 각도가 추력을 내는 방향으로 바뀌도록 변화되는 프로펠러, 수직날개의 각도변화에 따라 추진방향이 바뀌므로 우수한 조종성이 요구되는 선박에 활용됨
연직현측,Wall Side,정면도에서 현측선이 수직으로 나타나는 부분, 벽모양현측
연질목재,Soft Wood,결이 고르고 연한 목재
연차검사,Annual Survey,선박이 선급을 유지하기 위하여 매년 받는 검사로 검사항목은 선급규정에 명시됨
연철,Wrought Iron,반용융상태에서 단련하여 제조한 철로서 불순물이 적으며 철분의 순도가 높음
연판,Margin Plate,빌지부근에서 내저판의 양단을 외판에 고정시켜 주는 판
연해구역,Coasting Area,선박안전법에 따라 연해로 정의된 수역
연해구역선,Coasting Vessel,연해구역을 항해할 수 있는 설비를 갖춘 선박
열간압연,Hot Rolling,강괴나 반성품을 가열로에서 1200도씨 정도로 가열하여 압연롤에 의해 여러 종류의 형강과 판재로 성형 가공한 것
열감지기,Heat Detector Thermal Detector,온도상승을 감지해서 화재를 탐지하는 기구, 정온식(바이메탈)과 자동식(공기팽창)이 있음
열교환기,Heat Exchanger, Regenerator,고온유체에서 저온유체로 열을 전달하는 장치, 가열기, 냉각기, 응축기, 증발기 등
열기건조,Hot Air Seasoning,목재를 밀폐된 공간에 넣고 60~70도씨로 가열된 공기를 넣어 유지시켜 건조하는 방법
열기관,Heat Engine,열에너지를 기계적에너지로 변환시키는 원동기
열대,Tropical Zone,만재흘수선협약에 정해진 열대해역
열대건현,Tropical Freeboard,열대해역과 계절열대해역에서 해상을 운항하는 선박이 지켜아할 최소 건현
열대만재흘수선,Tropical Lord Line,열대해역과 계절열대해역에서 해상을 운항하는 선박이 지켜아할 최대흘수를 표시하는 흘수선
열대폭풍우,Tropical Storm,열대해역지방의 바다위에서 생기는 폭풍우로서, 극동지방은 태풍, 멕시코만과 카리브해에서는 허리케인, 인도양에서는 사이클론이라 칭함
열량계,Calorimeter,연료의 발생열량을 측정하는 기구
열복사,Heat Radiation,고온의 물체가 표면에서 적외선을 방출하는 현상, 대류나 접촉전도에 의하지 않고도 복사에 의해 열을 잃게됨
열소비율,Heat Rate,열기관이 단위출력을 내기 위하여 필요한 열량
열영향부,Heat Affected Zone : HAZ,용접열 또는 절단열에 의하여 용해되지는 않고, 다만 금속조직과 기계적 성질에 변화를 받게되는 부분
열용량,Calorific Capacity, Heat Content,어떤 물체의 온도를 1도씨 올리는데 필요한 열량
열응력,Thermal Stress,물체 내부의 불균일 온도분포에 의하여 각부의 자유로운 신축이 구속당해 생기는 응력
열전달,Heat Transfer,고체표면과 이에 접하는 기체(유체)사이의 접촉면을 통한 전열현상, 대류전달과 같음
열전대,Thermocouple,온도차이로 나타나는 기전력 차이를 측정함으로써 온도를 계측하는데 사용되는 2종금속의 짝
열전도,Heat Conduction,물체 내부의 열에너지가 물질의 이동 없이 고온에서 저온으로 전달되는 현상
열절연,Heat Insulation,열전도율이 낮은 물체로 주위를 둘러싸서 열의 이탈이나 유입을 막는 것
열절연재,Heat Insulation Materials,열의 발산이나 침입을 막아주는 재료
열중성자로,Thermal Reactor,열중성자에 의해 핵분열의 연쇄반응을 계속하는 방식의 원자로
열차도선,Train Ferry,철도열차를 그대로 실어나르는 배
열차폐,Thermal Shield,발생된 열의 유출을 막거나 외부열의 유입을 막아주는 것
열처리,Heat Treatment,금속재료를 특정온도까지 가열하고 적당한 속도로 냉각시켜 금속조직의 성장, 석출, 변태 등을 일으켜 필요로 하는 물성을 만들어주거나, 내부응력을 제거하는 공정
열충격,Thermal Shock,어떤 재료에 급격한 온도변화가 있으면 재료 내부의 온도차가 크게 되어 순간적으로 큰 응력이 발생하는 현상
열팽창,Thermal Expansion,온도상승에 따라 물체의 부피가 늘어나는 현상
열회수,Heat Recovery,열기관에서 작동을 마친 연소가스, 증기, 냉각수 등이 가진 열로서 배기터빈, 급기예열기, 급수가열기 등을 유효하게 가동시킴으로써 버리는 열량을 유효하게 이용하는 것
열효율,Thermal Efficiency,열기관에서 발생된 일과 열기관을 작동시키기 위하여 소비된 열에너지의 비
염장선,Salting Carrier,소금 운반에 사용되는 선박
영구변형,Permanent Set,물체에 작용하던 하중이 제거되어도 사라지지 않는 변형, 탄성한도 이상의 변형에서 나타남
영국식 단위,British Thermal Unit : BTU,영국의 열량단위,1 BTU = 0.2520 kcal
옆굽힘시험,Sidebend Test,용착부에 직교되는 방향으로 시료를 채취하여 용착금속의 절단면에 최대 인장력이 걸리는 방향으로 굽혀 절단발생을 확인하는 시험
옆면필릿용접,Fillet Weld in Parallel Shear,용접선의 방향이 그 부위에 걸리는 힘의 방향과 나란히 가는 필렛용접
옆바람,Beam Wind,배의 측면에 대하여 직각에 가까운 방향으로 부는 바람
옆방향,Abeam, Athwartship,(Abeam)선수미방향에 대하여 오른쪽 또는 왼쪽으로 직각인 방향,  (Athwartship)배의 선수미선에 직각으로 좌현에서 우현으로 가로지르는 방향
옆진수,Sideway Launching, Side Launching,배를 해안선에 평행하게 건조하여 횡방향으로 진수시키는 방법, 수면의 진수거리가 부족할 때 활용함
예비기,Stand-by Machine,이중장비가 요구되는 보기중의 하나
예비발전기,Stand-by Generator,사용중인 주발전기의 고장이나 정비시에 연속적인 급전을 위해 운전하는 별도의 주발전기
예비부력,Reverse Buoyancy,만재흘수선 위쪽의 수밀부분 용적
예비선원,Reverse Seafarers, Reserved Crew, Reserved Mariner,휴가, 신병, 대기 등으로 하선 중인 선원
예비실,Spare Room,평상시는 비어 두고 내빈용 등으로 사용하는 선실
예비앵커,Spare Anchor, Sheet Anchor,선수앵커의 예비앵커
예비전원,Stand-by Power,사용중인 전원의 고장이나 정비시에 연속적인 급전을 위해 별도로 설치된 전원
예비품,Spare Parts,기기류의 예비교환부품
예열,①Warming-up, ②Preheating,①열기관의 급격한 작동으로 무리한 부하가 걸리는 것을 방지하기 위해서 부하가 걸리지 않도록 일정시간 공회전하는 것, ②급속한 가열에 의한 모재의 손상(균열 등)을 막기 위하여 용접이나 절단 작업에 앞서 미리 모재를 가열하는 것
예열불꽃,Preheating Flame,가스절단에서 절단을 용이하게 하기 위하여 미리 가열시키는 불꽃
예인로프,Towing Rope,다른 선박을 예인하기 위하여 사용하는 로프
예인선,Tug Boat,대형선박, 거룻배, 푼툰, 뗏목, 해양구조물 등을 예인할 때 사용되는 배
예인수조,Towing Tank,배의 운항성능을 추정하기 위하여 모형시험을 수행하는 시험설비
예인윈치,Towing Winch,예인로프를 감아올리고 내리는 윈치
예인저항,Tow Rope Resistance,배를 끌 때 예인로프에 걸리는 저항
예인줄,Towing Rope,다른 배를 예인하거나 그물을 예인하는데 쓰이는 로프의 총칭
예인줄받이아치,Towing Arch,예인 줄의 장력이 선체구조물에 걸리지 않도록 선미에 세워둔 아치형 구조물
예항력,Towing Power,예인선의 예인력
예항로그,Towing Log,선미에서 로그를 예인하여 속도를 알아내고 적산하여 항해거리를 알아내는 장치
예행시운전,Preliminary Trial,공식시운전 이전에 실시하는 비공식시운전
오뚝이형구명정,Self Righting Type Life Boat,킬을 무겁게 만들고 예비부력을 많이 주어 전복되어도 스스로 일어서도록 충분한 복원력을 갖는 구명정
오른편꼬임,Right Hand Lay,로프를 꼬는 방향이 오른쪽으로 된 것, 오른편 꼬임은 Z꼬임, 왼편꼬임은 S꼬임
오목필릿용접,Concave Fillet Weld,용접부의 용착금속 표면이 오목꼴로 된 필렛용접
오물선,Sewage Boat, Sludge Boat,오물운반에 쓰이는 배
오물해양폐기선,Sewage Carrier,오물을 소정의 해양까지 운반하여 버리는 선박
오버랩,Overlap,용접 비드의 끝에서 용착금속이 모재에 녹아 붙지 못하고 불거져 있는 상태, 응력집중, 부식 촉진 등의 원인이 됨
오손,Fouling,배 바닥에 해양생물이 부착되는 것
오수관,Soil Pipe,화장실 등의 오수를 오물탱크나 배 밖으로 보내 주는 관
오염제거,Decontamination,기구, 의복, 마루 등에 부착된 방사능 물질을 제거하는 것
오일버너,Oil Burner,기름 등을 연소시키는 장치
오일섬프,Oil Sump,기름을 저장하는 장소나 용기의 총칭
오일스위치,Oil Switch,고전압회로의 차단하는 개폐기구가 기름에 잠기도록 된 차단기
오일팬,Oil Pan, Oil Tray,기름탱크 ,기름가역기 등의 밑에 받쳐 흘린 기름을 받도록 된 팬
오일펜스,Oil Fence,수면에 뜬 기름의 확산을 막기 위해 수면에 설치하는 부유식 울타리
오일필링커넥션,Oil Filling Connection,선외로부터 선내탱크에 기름을 받아 넣는 쇠붙이
오컴,Oakum,목갑판의 틈새를 메꾸는 나무껍질로 된 섬유다발
오터보드,Otter Board,트롤어망의 입구가 예인 중에 벌어져 있게 하기 위해서 버텨 주는 판
오터트롤러,Otter Trawler,오터트롤어업에 종사하는 어선
오픈로저,Open Hawser,두 개의 닻이 서로 엉키지 않은 묘박상태
오피에이90,OPA90 : Oil Pollution Act 90,미국정부가 자국연안의 유류오염방지를 위해 제정한 국내법령으로 유조선의 2중선체(Double Hull)를 의무화한 규정, 뒤에 국제규정으로 채택됨
온기난방,Hot Air Heating,공기를 데워서 보내는 난방방식
온도조절기,Temperature Cotroller,온도검출, 신호로 변환, 밸브작동 등의 순서로 필요한 기계의 온도조절을 실행하는 기기
온수기,Calorifier,물을 데워 주는 기구
온수난방,Hot Water Heating,방열기(래디에이터)에 온수를 순환시켜 난방하는 것
올림속도,Hoisting Speed,크레인, 호이스트, 윈치 등에서 물건을 달아 올리는 속도
옵티컬로그,Optical Log,해면의 부유물이나 수중부유물의 움직임 등을 광학적으로 관찰하여 촉도를 측정하는 장치
와류,Eddy, Vortex,유체유동 중에 나타나는 소용돌이현상
와류저항,Eddy Making Resistance,선박이 항주할 때 선체주위의 유체운동에서 생기는 와류로 인한 저항
와셔,Washer, Facing Ring, Rove,볼트나 너트로 물건을 조일 때 물건과 볼트 또는 너트 사이에 끼우는 고리
와이어가이,Wire Guy,와이어로프로 만든 가이
와이어게이지,Wire Gauge,철사의 지름을 측정하는 게이지
와이어로프,Wire Rope,강철선을 여러 겹 꼬아서 만든 로프
와이어릴,Wire Reel,와이어로프를 감아 두는 동태
와이어브러시,Wire Brush,강철사로 만든 브러시로 철판의 가벼운 녹 등을 제거할 때 사용함
와형스프링,Spiral Spring,소용돌이 꼴로 강판을 말아 만든 스프링
완성검사,Complete Survey,선박이 완성되었을 때 선체, 기관, 의장 및 부속기구에 대하여 선급규칙과 법규에 합당한 지를 확인하는 검사
완성캐비테이션프로펠러,Fully Cavitating Propeller,완전 캐비테이션 프로펠러와 동일
완전연소,Complete Combustion,연료를 연소시킬 때 연소생성물 가운데 가연성 물질이 남아 있지 않은 상태
완전용입,Full Penetration, Complete Joint Penetration,용접부의 단면으로 볼 때 모재와 용접재가 접합부에서 같이 용융되어 충분히 결합된 상태
완전캐비테이선프로펠러,Supercavitating Propeller, Fully Cavitating Propeller,프로펠러 날개의 캐비티가 뒷날까지 완전히 형성되는 상태에서 효과적으로 쓰이도록 설계된 프로펠러
완전평형타,Fully Balanced Rudder,타판의 일부가 타축 앞에 있어 타에 작용하는 압력중심이 타축 근방에 위치하도록 만든 타
완전필릿용접,Full Fillet Weld,두께가 다른 두 판을 연결할 때 차이나는 두께부분을 필렛용접으로 채우는 것
완충기,Shock Absorber,충격완화를 위한 충격흡수 기계장치
완충스프링,Buffer Spring,충격을 완화시켜 주는 스프링
왕복동기관,Reciprocating Engine, Reciprocater,피스톤의 왕복운동이 연결봉을 통하여 크랭크에 작용함으로써 회전운동으로 변하게하는 기관
