한글,영문,설명
베니어판,Veneer Board,얇은 목판을 결이 서로 직교하도록 겹쳐붙인 판재
베벨,Bevel,각도 측정기구, 일정 각도로 깎여진 경사면
베벨각,Bevel Angle,부재 끝에 홈을 만들기 위하여 가공한 면과 부재 표면에 수직인 면이 이루는 각
베벨기계,Beveling Mchine,베벨각을 잡아주는 기계, 용접 그루브 형성을 위해 베벨을 깎아주는 기계
베벨늑골,Bevel Frame,경사부의 외판과 만나는 늑골의 접축각을 유지하기 위하여 각도를 틀어준 늑골
베벨절단,Bevel Cut,표면에 대하여 직각이 아닌 기울어진 각도로 절단하는 것
베어링,Bearing,회전축과 지지대 간의 마찰을 최소화하기 위해 사이에 끼우는 여러 형태의 부착물, 볼베어링, 롤러베어링, 메탈베어링 등
베어링메탈,Bearing Metal,메탈베어링에 사용되는 원통형의 금속, 베어링 부시(Bearing Bush)로도 칭함
베이퍼록,Vapor Lock,연료유관 내에 증기가 차서 연료유펌프에서 연료공급이 안되는 상태
베인프로펠러,Vane Propeller,얕은 흘수에서 사용되는 나선형프로펠러, 약 40%만 물에 잠김
베일러,Bailer,배에 들어온 물을 퍼내는 바가지
베킷,Becket,화물을 한묶음으로 하역훅(고리)에 걸어주는 그물도구
벤드,Bend,경이 큰 관의 꺾임부에 사용되는 굽어진 토막, 경이 작은 것은 엘보(Elbow)라 칭함
벤트관,Vent Pipe,화물유탱크내의 과압과 부압의 방지를 위한 통기관
벨로즈식 신축관이음새,Bellows Type Expansion Pipe Joint,주름진 관으로 만든 신축식 이음토막
벨마우드,Bell Mouth,액체의 흡입관 끝에 붙는 깔때기모양의 관, 선수부 앵커가 매달리는 부분의 외판경사면에 붙는 두꺼운 주강제 원통형주둥이
벨트컨베어,Belt Conveyor, Rotary Conveyor,회전하는 벨트위에 물건을 놓고 이동시키는 운반장치
변동피치프로펠러,Varying Pitch Propeller, Non-uniform Pitch Propeller,날개의 피치가 반지름방향위치에 따라서 다르게 만들어진 프로펠러
변두리이음,Edge Joint,두 부재의 겹친 끝면을 함께 용접하는 이음
변두리이음용접,Edge Joint Welding,변두리 이음형식의 용접
변류기,Current Transformer, Converter,전류계, 전력계, 계전기 등의 코일에 큰 전류나 고압전위가 걸리지 않고 측정하도록 해 주는 전류변환기
변압기,Transformer,1차코일과 2차코일의 권수비례에 따라 교류전압을 변환시켜주는 장치
변형,Deformation,구조물의 외력에 의한 치수, 모양 등의 변화
변형경화,Strain Hardening,재료에 항복점 이상의 하중이 걸려 소성변형이 일어났을 때 재료의 경도가 높아지는 현상
변환기,Transducer,기계적신호를 전기적신호로 바꿔주는 장치의 총칭
병력수송선,Troopship,군대와 군수물자를 수송하는 선박
병렬단속필렛용접,Chain Intermittent Fillet Welds,대칭되게 비드를 놓는 단속필렛용접
병렬식,Parallel System,부하를 병렬로 연결하여 전력을 공급하는 배전방식, 2개이상의 기계를 나란히 놓는 방식
병실,Sick Bay, Hospital,환자를 진찰하고 치료하는 방
병원선,Hospital Ship,병자치료와 수송에 필요한 설비와 의료요원을 갖춘 선박
보,Beam,굽힘 하중을 받는 막대재, 양현늑골의 상단을 연결하여 갑판을 지지하는 가로재
보강,Strengthening, Reinforcement,구조물이나 부재의 강도를 증가시키는 것
보강구조,Reinforced Structure,선체구조에서 강도가 약해진 곳이나 국부적으로 큰 하중이 걸리는 부분 등에 강도를 높여준 구조
보강링,Compensation Ring, Strengthening Ring,구멍의 주위를 보강하기 위해 덧붙이는 링
보강봉,Strrup, Hoop,콘크리트 선박의 횡방향 형상유지를 위해 설치하는 철강제 봉 골격(철근)
보강재,Stiffener,판재가 하중을 받아 휘거나 변형되는 것을 막아주기 위해 붙이는 형재
보권장치,Auxiliary Hoisting Gear,달아올리는 훅, 도르래, 로프, 권상기 등 보조하역에 사용되는 장치의 총칭
보극,Interpole, Compensating Pole,전기회전기에서 전자반작용을 줄이고 전압을 정류하여 정류자속을 얻기위해 주극 사이에 설치하는 분할된 작은 전극
보급선,Tender,정박중인 큰 배와 육지 사이를 오가며 인원 물자 등을 실어나르는 작은 선박
보급함,Supply Ship,작전중의 군함에 기름, 식량, 탄약 등을 공급하는 보조함
보기,Auxiliary Machinery,선박에 장비된 주기를 제외한 모든 기기들의 통칭, 갑판보기와 기관실보기로 분류함
보닛,Bonnet,모터보트의 엔진을 씌워주는 목제 또는 금속제 덮개
보링,Boring,구멍을 뚫거나 구멍의 내벽을 깎는 가공
보링머신,Boring Machine,보링작업을 하는 공작기계
보상공사,Guarantee Work,선박이 완공 인도된 후 일정기간 동안에 발생하는 하자에 대하여 조선소가 무상으로 보수해주는 것
보상침수,Cross Flooding,선박이 침수로 한쪽이 기울 때 이를 바로 세우기 위하여 반대쪽에 물을 채우는 것
보스,Boss,허브와 동의어
보스외판,Boss Plate,주진축이 선미로 노출되는 끝부분에 붙는 선미관을 둘러싼 외판
보싱,Bossing,선체 밖으로 나온 축 등을 둘러싸는 외판의 총칭, 수밀, 흐름의 각도완화, 축의 지지 등 다목적임
보온복,Thermal Protective Aid,온도보호가 잘되는 방수물질로 된 옷 또는 포대기
보온시멘트,Heat Insulating Cement,물로 반죽하여 붙이는 보온재, 규조토, 석면, 시멘트 등
보이론,Beam Theory,굽힘하중을 받는 보에 발생하는 굽힘응력, 전단하중의 크기, 처짐형상 등을 구하는 재료역학이론
보일러,Boiler,증기보일러 참조
보일러 부품,Boiler Fittings, Boiler Mountings,보일러에 붙는 밸브, 게이지, 순환장치, 불로어 등의 총칭
보일러 스케일,Boiler Scale, Boiler Incrustation,급수중에 포함된 수용성염류가 침전되거나 벽에 부착되어있는 상태, 열전도를 방해하고 부식의 원인을 제공함
보일러 주위간격,Boiler Clearance,보일러와 측벽 사이의 간격, 보일러의 운전과 보수에 필요한 거리확보를 위해 중요
보일러마력,Boiler Hosepower,저압보일러의 증기발생능력을 나타내는 단위
보일러받침,Boiler Bearer, Boiler Seating, Boiler Stool,보일러를 받쳐주는 지지대
보일러수 시험기,Boiler Water Testing Apparatus,보일러수의 수질시험을 하는 기구, 시험관, 플라스코, 시약 등이 세트로 되어 있음
보일러용 강재,Boiler Steel,보일러의 동체와 같은 주요구조에 사용되는 킬드강
보일러청정제,Boiler Compound,보일러수에 첨가되어 정화시켜주는 화학약품
보일러케이싱,Boiler Casing,보일러 주위를 싸주는 껍질로서 보온, 가스누출 방지 등의 역할을 함
보일러흑연,Boiler Graphite,보일러 내부방식을 막아주는 흑연도료
보정,Compensation,기기에서 주위조건 변화에 따르는 오차를 제거하는 것
보정탱크,Compensation Tank,잠수함에서 소비되는 소모품의 중량에 해당되는 물을 채워주워주는 탱크
보조기관,Auxiliary Engine, Donkey Engine,선박에서 추진에 사용되지 않는 엔진들의 총칭
보조기관붙이범선,Sailing Vessel With Auxiliary Enginr,추진장치로서 돛을 사용하고 엔진은 보조하는 용도로 구비한 배
보조선,Auxiliary Vessel,전함, 항공모함, 순양함, 구축함, 잠수함 등의 전투함을 제외한 모든 함정들의 총칭
보조앵커,Branch Anchor,앵커의 파지력을 높이기 위하여 주앵커체인에서 나누어 달린 보조체인에 붙은 앵커
보증기사,Guarantee Engineer,새로 설치된 기관의 작동을 확인하기 위하여 제작사에서 항해에 동승시키는 기술자
보증속력,Guarantee Speed,선박의 건조계약시 선박의 성능에 대한 약속 중 속력에 대한 항목, 완공 후의 시운전시에 확인됨
보증응력,Proof Stress,어떤 재료가 견딜 수 있는 최대응력, 일반적으로 항복응력과 동일
보충급수,Supplementary Feed, Make-up Feed,증기기관에서 누설에 의한 손실량을 보충해주는 급수
보침,Course Keeping,배가 침로를 유지하는 것
보텀헤비,Bottom Heavy,배의 중심위치가 낮아진 상태
보텍스캐비테이션,Vortex Cavitation,프로펠러의 허브, 날개끝, 후류에 생기는 보텍스와 동반되는 캐비테이션의 총칭
보통선객,steerage Passenger,독방을 차지하지 않는 가장 싼 운임의 여객
보트걸이 훅,Lifting Hook, Sling Hook,보트의 앞과 뒤에 달리는 훅
보트덮개,Boat Cover,격납상태의 보트를 보호하는 덮개
보트스케이트,Boat Skate,보트가 현측을 잘 미끄러지게 하기위해 보트에 붙인 가이드
보트스키드,Boat Skid,보트가 현측을 잘 미끄러지게 하기위해 현측에 붙인 가이드
보트펄,Boat Fall,보트의 승강에 사용되는 로프
보행다리,Gangway, Bridge,상갑판 위에 설치되어 선루와 선루사이를 오가게 만든 통행로, 구름다리
보호봉,Guard Bar,프로펠러의 전리부식을 막기 위해 부근에 붙여주는 아연판
보호안경,Goggles,용접시에 용접광선과 불똥 등으로 부터 눈을 보호하기 위하여 작업자가 쓰는 안경
보호유리,Cover Glass, Shield Glass,용접할 때 사용되는 필터유리를 보호하기 위하여 겉에 끼우는 투명유리
보호피막,Protective Coatings,표면의 오손이나 부식을 방지하기위해 입히는 금속 또는 비금속 피막
복갑판선,Awning Deck Vessel, Awning Decker,차랑갑판선 참조
복동기관,Double Acting Engine,왕복동기관에서 피스턴의 양쪽에서 교대로 가스나 증기압을 작동시켜 움직이는 기관
복사열,Radiant Heat,물체표면에서 방사상으로 직진해서 투사되는 열, 열복사
복수기,Condensing Plant,증기를 냉각하여 액화시키는 장치
복식용접기,Multiple Operater Welding Machine,한 대의 용접기로 여러 사람이 동시에 용접할 수 있는 직류용접기
복원력,Restoring Force,외력에 의해서 평형에서 벗어난 물체가 스스로 원상태로 돌아가고자하는 힘
복원력 멸실점,Vanishing Point of Stability,배의 정적복원력이 0일때, 배의 경사각복원력곡선이 기선과 만나는 점의 경사각
복원모먼트,Restoring or Righting Moment,배가 외부모먼트에 의해서 초기평형상태가 깨졋을 때 스스로 초기상태로 돌아가고자 하는 모먼트
복원성,Stability,배가 외력에 대항하면서 직립자세를 유지하려는 성능
복장갑,Compound Armor,군함에 붙인 장갑판의 일종, 표면과 이면의 경도와 연성이 서로 다른 강판을 결합시켜, 포탄의 충격을 견디도록 강화됨
복판타,Double Plate Rudder,주강이나 단강으로 타 골격을 구성하고 양면에 강판을 용접하여 붙인 타
복합형플랜지,Composite Flange,동합금파이프의 연결에 사용되는 플랜지로 동합금 소켓부분을 납땜으로 관끝에 붙이고 플랜지부분은 강제플랜지와 연결하는 형식임
본,Template, Templet,강재의 곡가공 등에 사용되는 곡면 등을 딴 본
본드,Bond,비도전 금속부 상호간의 전기적 접촉을 확실히 하기 위해 실시하는 접촉
본전곡선,Bonjean`s Curve,선박의 길이를 등분하는 스테이션 위에 선박의 측면도와 해당횡단면 면적곡선을 포개그린 곡선
볼-소켓연결,Ball and Socket Coupling, ball Joint,두 끝을 연결할 때 한 쪽은 공모양으로, 다른 쪽은 공을 감싼  모양으로 하는 연결로 두 연결 축의 자유도가 커짐
볼라드,Bollard,선박을 계류시킬 때 로프를 감아매는 갑판상의 짧은 한쌍의 기둥, 한 개로 된 것은 비트라 칭함
볼라드시험,Bollard Test,선박이 안벽에 계류된 상태에서 프로펠러의 추진성능을 계측하기 위해 행하는 시험
볼록필렛용접,Convex Fillet Weld,비드 표면이 볼록하게 형성되는 필렛용접
볼베어링,Ball Bearing,마찰면에 볼을 끼워 돌게함으로써 회전마찰을 줄이도록 만든 베어링
볼스터,Bolster,마모를 막기 위해 모가 진 곳에 붙이는 목재나 매트, 앵커 케이블의 마찰과 마모를 줄이기 위해 호우저 파이프 주변에 붙이는 덧판
볼조인트,Ball Joint,볼모양구조에 의하여 회전각이 자유롭게 되도록 연결한 준설관의 이음
볼진수,Ball Launching,배의 진수에서 고정대와 활주대 사이에 볼을 깔아 마찰을 줄인 미끄럼 진수방식의 하나
봉 지름,Core Diameter,피복 아크용접봉의 심선의 지름(굵기)
봉강,Bar Steel,단면이 원으로 된 형강재
봉격자,Bar Grating,봉강으로 구성한 발판용 격자, 기관실 내의 좁은 통로 등에 활용
부가물저항,Resistance Appendage,빌지킬, 타, 보스, 스라스터 등 부가물에 의해 추가되는 배의 저항
부교,Pontoon Bridge,상자형 부유물의 상면에 마루를 깔아놓은 보도 또는 다리
부기부호,Classification Character,선급부호 참조
부늑골,Reverse Frame,이중저구조에서 늑판 밑에 붙여지는 형재
부동항,Ice-free Port,겨울에도 얼어붙지 않는 항구
부동혼합액,Non-freezing Mixture,두 가지 이상의 물질을 혼합하여 낮은 온도에서도 얼지 않게 한 액체
부두,①Pier, ②Wharf,①해안에 고정 설치된 선박의 정박시설, ②선박의 접안, 계류, 하역 및 화물의 저장 등을 위한 하역설비가 갖추어진 곳
부두관리인,Wharfinger,부두의 모든 시설을 관리하는 사람
부두사용료,Wharfage,부두를 사용했을 때 부과하는 요금
부력,Buoyancy,중력장에서 유체속에 물체를 담갔을 때 유체로부터 물체에 작용하는 힘
부력곡선,Buoyancy Curve,배의 길이방향으로 부력분포를 나타낸 곡선
부력식발연신호,Buoyant Smoke Signal,구명정에 비치하는 주간용 신호로서 수면에 떠서 황적색의 연기를 내주는 신호장치
부력실,Buoyancy Chamber,부력을 주는 구획
부력탱크,Buoyancy Tank,부력을 주는 탱크
부망어선,Square Netter,사각형어망을 물에 펼쳐놓고 미끼나 집어등으로 고기를 모은 후 그물의 가장자리를 졸라 고기를 잡는 어선
부분노출프로펠러,Interface Propeller,프로펠러 원판면적의 일부가 공기중에 노출되어 사용되는 공기공급식 완전캐비테이션 프로펠러, 공기부양선 등에 사용됨
부분용입,Partial Joint Penetration : PJP,이음부의 전체를 덮지 못한 불충분한 부분적인 용입
부선,Barge, Pontoon,하천과 항만에서 운송, 하역 등에 보조적으로 사용되는 상자형 무동력선
부스터,Booster,압력이나 출력을 높여주는 보조장치
부스터방식,Booster System,승압장치를 회로에 직열로 연결시커 전압을 변화시킴으로써 회로전압을 제어하는 방식, 전동기  속도제어에 이용됨
부시,Bush,회전축을 지지하는 곳의 마찰과 마모를 줄이기 위하여 사이에 삽입되는 원통형  금속재료, 청동주물 또는 화이트메탈 사용
부식균열,Corrosion Cracking,응력과 부식이 동시에 작용하여 국부적으로 나타나는 균열현상
부식시험,Etch Test, Corrosion Test,재료의 내식성을 검사하는 시험
부식여유,Corrosion Margin,구조부재의 부식을 고려하여 판 두께를 증가시킨 부분
부식피로,Corrosion Fatigue,금속이 부식환경에서 반복하중을 받으면 피로강도가 현저하게 떨어지는 현상
부심,Center of Buoyancy,부력의 중심, 배수용적의 중심
부양식 독,Floating Dock,양단이 열려있고 큰 범위로 부침되는 갑판 위에 선박을 올리거나 내릴 수 있게 만든 부양체로서 선박수리에 필요한 크렌설비 등도 갗춘 이동식 독
부양이탈진수,Float Free Launching,침몰선에서 따로 예비된 생존정을 자동으로 분리시켜 띄워주는 진수방식
부유선교,Floating Pier, Floating Landing Stage,부유체를 이용한 잔교
부유유수인입장치,Spilled Oil Collecting Device,오염된 해면의 유수를 흡입하는 장치
부정기선,Tramper,특정화주와의 계약에 따라 부정기적으로 운행하는 화물선
부표,Buoy,항로표시, 계선 등을 위해 설치되는 부유체 구조물, 닻, 추, 케이블 등으로 해저에 고정됨
부표계류,Buoy Mooring,배를 부표에 계류하는 것
부표설치선,Buoy Tender,항로표시의 설치와 유지 보수 등에 사용되는 선박
부표표식,Floating Sign,부표가 나타내는 의미를 표시하는 것으로 주간에는 색, 형상, 꼭지모양 등으로, 야간에는 빛의 색깔과 발광방법으로 나타냄
부풀음,Blister,강판의 제련과정이나 압연과정에서 남은 가스층이 얇게 존재하다가 외부가열에 의해 팽창되어 판의 일부가 부풀어 오른 상태
부하,Load,기계장치 등의 구동에 걸리는 일(짐)
부현측후판,Strake below Sheer Strake,현측후판 바로 아래줄에 배치되는 외판으로 현측후판과 일반외판의 중간두께를 취함
부호호출법,Code Calling System,무선전신이나 깃발신호에 의한 호출부호로 호츨하는 방법
분기함,Branch Box,전기회로의 분기접점이 들어있는 상자
분기회로,Branch Circuit, Sub-circuit,전류의 흐름을 두 갈래 이상으로 가르는 회로
분뇨처리장치,Sewage Treatment unit,선내 분뇨나 오수를 배출하기 전에 처리해주는 장치
분당회전수,RPM : Revolution per Minute,회전기계의 분당 회전수
분리기,Separator,기체, 액체, 고체 등의 혼합물을 각기 다른 상으로 분리하거나, 차이나는 비중으로 분리하는 기구
분말소화기,Dry Powder Fire Extinguisher,미세분말을 유체처럼 덮히게 하기 위하여 화학처리된 소화분말이 들은 소화기
분말소화장치,Chemical Powder Fire Extinguishing Apparatus,분말용기, 가압용기, 노즐 등으로 구성되어 소화용 분말을 분사하는 소화장치
분말절단,Powder Cutting,절단용 산소에 철분이나 용제를 혼합한 고압가스를 자동으로 공급하여, 이때 발생하는 철의 산화열과 용제에 의하여 금속을 용융 절단하는 절단법
분무기,Atomizer,액체를 미세한 입자상으로 만들어주는 장치
분무노즐,Fog Nozzle, Spray Nozzle,액체를 분무시켜주는 분무주둥이
분사,Injection,압력을 가하여 액체를 작은 구멍으로 뿜어내는 것
분사공기,Blast Air,공기분사식 디젤기관에 사용되는 고압공기
분쇄기,Crusher,돌, 석탄, 광석, 등을 잘게 부숴주는 기계
분전반,Distribution Board,,두 개이상의 분기회로에 사용되는 분기용 개폐기, 안전장치가 붙은 패널
분전상자,Distribution Board, Panel Board,과부하보호장치를 곁들여서 두 개이상의 말단회로에 전력을 공급하는 패널이 들은 상자
분탄,Slack Coal,크기가 대략 25mm이하로 된 가루석탄
분필시험,Chalk Test,밀폐가 요구되는 접촉면에 분필가루를 칠하여 상호접촉상태를 조사하는 시험
분할스테이션,Square Station,배의 측면선도(Sheer Plan)상에서 선수 미간을 등간격으로 분할하여 그은 수직선
불감구역,Blind Section, Shadow Section,보통의 작동에서, 어떤 장애 때문에 물체의 에코강도가 약해져서 물체형상이 잘 나타나지 않는 부채꼴 부분
불규칙최대경사각,Lurch,돌발적인 외력으로 발생된 선체의 최대경사각
불균일피치프로펠러,Variable Pitch Propeller,반지름방향으로 피치가 변화되는 프로펠러
불꽃,Flare-up Light,불꽃를 내는 신호염으로 위급시나 경보용으로 사용됨
불꽃경화,Flame Hardening,가스불꽃의 열에 의하여 금속의 표면을 경화시키는 방법
불꽃심,Flame Cone,가스블꼴 중 토치 입구부근의 청백색부분
불꽃어닐링,Flame Annealing,기름버너나 가스버너를 이용한 풀림열처리
불꽃전파용접,Fire Cracker Welding,피복아크 용접봉을 용접 이음부에 따라 밀착시키고 구리로 된 지그로 한쪽 끝에서 눌러 아크를 발생시켜 용접봉을 따라 자동적으로 용접되게 하는 용접법
불꽃절단,Flame Cutting,연소가스 불꽃의 열을 이용하여 절단하는 것
불꽃절삭,Flame Machining,특수한 모양의 토치를 사용하여 부재를 가열 절삭하는 것
불꽃점화,Jump Spark Ignition, High Tension Ignition,점화플래그에 고압전류를 보내 불꽃을 일으켜 실린더 내의 혼합가스에 점화하는 방법
불꽃조정,Flame Adjustment,가스용접시에 용접조건에 맞게 불꽃을 조절하는 것
불꽃청소,Flame Cleaning,가스블꽃으로 강재표면을 가열하여 표면의 습기, 녹, 기름때 등을 태워 없애는 것
불꽃홈파기,Flame Gouging,특수한 모양의 토치로 가스불꽃을 이용하여 U형상의 골을 파는 것
불안정평형,Unstable Equilibrium,배의 무게중심이 메타센터보다 위쪽에 있는 불안정한(Top Heavy) 상태
불연성재료,Incombustible Material,규정된 불연성시험에서 타지 않고 규정 이상의 인화성 증기나 가스를 발생하지 않는 재료
불워크,Bulwark,상갑판이나 선루갑판의 통행안전을 위해 설치하는 현측 담장판
불워크기둥, 불워크지주,Bulwark Stay, Bulwark Stanchion,불워크판을 지지하기 위해 일정간격으로 갑판 현측에 세우는 부재
불워크망,Bulwark Net,여객갑판의 불워크가 없는 공간에 대신 세우는 망
불워크배수구,Bulwark Freeing Port,갑판배수를 위하여 불워크 하부에 뚫어 주는 배수구
불워크선,Bulwark Line,선체선도에서 불워크 상단내면을 나타내는 선
불워크스트레이크,Bulwark Strake,불워크판의 보강을 위하여 안쪽에 붙이는 종보강부재
불평형타,Unbalanced Rudder,수압을 받는 면이 타 회전축의 후방에 있는 타
불활성가스,Inert Gas,연소나 폭발이 잘 일어나지 않는 안정된 기체로서,  화물유창의 공간충진이나 아크용접 등에서 차폐가스(Shield Gas) 등으로 활용됨, Ar, He, 탄산가스 등
불활성가스 금속 아크용접,MIG Welding, Inert Gas Shielded Metal-arc Welding,불활성가스 아크용접의 하나로, 용접금속을 전극으로 하는 아크용접
불활성가스 덱실,Inert Gas Deck Seal,화물유탱크내의 가스가 불활성가스장치로 역류하는 것을 막아주는 기기
불활성가스 소화장치,Inert Gas Smothering System,불활성가스를 사용하는 소화장치
불활성가스 아크용접,Inert Gas Shielded Arc Welding,알곤, 헬륨 등 불활성가스나 이들과 소량의 활성가스로 된 가스분위기에서 행하는 아크용접
불활성가스 텅스텐 아크용접,TIG Welding, Inert Gas Shielded Tungsten-arc Welding,불활성가스 아크용접의 하나로, 텅스텐 등 비소모금속을 전극으로 하는 아크용접
불활성가스발생장치,Inert Gas Generator,연료를 연소시켜 산소농도가 낮은 연소가스를 생성하여 불활성가스로 사용하게 해주는 장치
불활성가스세척기,Inert Gas Scrubber,화물유탱크에 공급하는 불활성가스에 물을 분무하여 온도를 내려주고 아황산가스 등 불순물을 제거해 주는 장치
불활성가스장치,Inert Gas System,불활성가스를 화물유창에 충만시켜 폭발과 화재를 예방하는 장치
불휘발성기름,Fixed Oil,대부분의 식물유 및 동물유처럼 건성 또는 반건성의 기름
붐,Boom,장대, 화물의 하역에서 사용되는 길게 뻗은 장대, 밑둥은 포스트에 지지되고 다른 끝에서 도르래를 타고  하역로프가 내려가 화물을 고리에 달고 장대가 선회하여 이동함,
붐받침대,Boom Rest, Boom Support,붐이 사용되지 않을 때 자유단인 끝 부분을 지지해주는 받침대
붙박이욕실,Unit Bath,세면기, 욕조, 변기 등을 붙박이로 만들어 놓은 기성품 욕실
브라운관,Cathde Ray Tube,레이더의 표시기로 사용되는 전자관, 관 내벽에 전자빔을 조사하여 형상이 보이게 함
브라인,Brine,증발기에서 냉매를 냉각시키는데 쓰이는 부동액
브라인식,Brine System,브라인을 매체로 하여 냉각하는 간접냉각방식
브래킷 등,Bracket Lamp,탁상등의 일종
브래킷늑골,Bracket Frame,정늑골과 부늑골이 등간격으로 나란히 가며 중간브래킷으로만 연결된 경구조의 늑골
브레스트 훅,Breast Hook,선수재와 인접된 외판을 한데 묶어주는 수평보강재
브레스트라인,Breast Line,선박이 안벽에 계선될 때 선수 선미에서 선박길이의 직각방향으로 묶어주는 계선줄
브레이크 슈,Brake Shoe,제동장치에서 브레이크 드럼을 눌러주는 부품
브레이킹 죠인트,Breaking Joint,서로 교차하지 않고 평행하지 않은 두 축 사이의 동력을 전달하는 방식
브리지스폿용접,Bridge Spot Welding,한쪽 면에 덧판(Backing Metal)을 대고 하는 점용접
